Symbol,Name,Sector,Industry
RILYN,B. Riley Financial Inc. 6.50% Senior Notes Due 2026,Consumer Discretionary,Business Services
RILYO,B. Riley Financial Inc. 6.75% Senior Notes due 2024,Consumer Discretionary,Business Services
RILYP,B. Riley Financial Inc. Depositary Shares each representing a 1/1000th fractional interest in a share of Series A Cumulative Perpetual Preferred Stock,Finance,Investment Managers
RILYT,B. Riley Financial Inc. 6.00% Senior Notes Due 2028,Consumer Discretionary,Business Services
RILYZ,B. Riley Financial Inc. 5.25% Senior Notes due 2028,Consumer Discretionary,Business Services
RIOT,Riot Platforms Inc. Common Stock ,Technology,Retail: Computer Software & Peripheral Equipment
RITM,Rithm Capital Corp. Common Stock,Real Estate,Real Estate Investment Trusts
RIVN,Rivian Automotive Inc. Class A Common Stock,Consumer Discretionary,Auto Manufacturing
RJF,Raymond James Financial Inc. Common Stock,Finance,Investment Bankers/Brokers/Service
RKDA,Arcadia Biosciences Inc. Common Stock,Consumer Staples,Farming/Seeds/Milling
RKLB,Rocket Lab USA Inc. Common Stock,Industrials,Aerospace
RKT,Rocket Companies Inc. Class A Common Stock,Finance,Finance: Consumer Services
RL,Ralph Lauren Corporation Common Stock,Consumer Discretionary,Apparel
RLAY,Relay Therapeutics Inc. Common Stock,Health Care,Biotechnology: Pharmaceutical Preparations
RLGT,Radiant Logistics Inc. Common Stock,Consumer Discretionary,Oil Refining/Marketing
RLI,RLI Corp. Common Stock (DE),Finance,Property-Casualty Insurers
RLJ,RLJ Lodging Trust Common Shares of Beneficial Interest $0.01 par value,Real Estate,Real Estate Investment Trusts
RLMD,Relmada Therapeutics Inc. Common Stock,Health Care,Biotechnology: Pharmaceutical Preparations
RLYB,Rallybio Corporation Common Stock,Health Care,Biotechnology: Pharmaceutical Preparations
RM,Regional Management Corp. Common Stock,Finance,Finance: Consumer Services
RMBL,RumbleOn Inc. Class B Common Stock,Consumer Discretionary,Automotive Aftermarket
RMBS,Rambus Inc. Common Stock,Technology,Semiconductors
RMCF,Rocky Mountain Chocolate Factory Inc. Common Stock,Consumer Staples,Specialty Foods
RMD,ResMed Inc. Common Stock,Health Care,Medical/Dental Instruments
RMGC,RMG Acquisition Corp. III Class A Ordinary Shares,Finance,Blank Checks
RMGCU,RMG Acquisition Corp. III Unit,Finance,Blank Checks
RMGCW,RMG Acquisition Corp. III Warrant,Finance,Blank Checks
RMNI,Rimini Street Inc. (DE) Common Stock,Technology,EDP Services
RMR,The RMR Group Inc. Class A Common Stock,Finance,Real Estate
RMT,Royce Micro-Cap Trust Inc. Common Stock,Finance,Investment Managers
RMTI,Rockwell Medical Inc. Common Stock,Health Care,Biotechnology: Pharmaceutical Preparations
RNA,Avidity Biosciences Inc. Common Stock,Health Care,Biotechnology: Pharmaceutical Preparations
RNAZ,TransCode Therapeutics Inc. Common Stock,Health Care,Biotechnology: Pharmaceutical Preparations
RNGR,Ranger Energy Services Inc. Class A Common Stock,Energy,Oilfield Services/Equipment
RNP,Cohen & Steers REIT and Preferred and Income Fund Inc. Common Shares,Finance,Investment Managers
RNST,Renasant Corporation Common Stock,Finance,Major Banks
RNXT,RenovoRx Inc. Common Stock,Health Care,Biotechnology: Pharmaceutical Preparations
ROAD,Construction Partners Inc. Class A Common Stock,Industrials,Engineering & Construction
ROC,ROC Energy Acquisition Corp. Common Stock,Industrials,Consumer Electronics/Appliances
ROCAR,ROC Energy Acquisition Corp. Rights,Industrials,Consumer Electronics/Appliances
ROCC,Ranger Oil Corporation Class A Common Stock,Energy,Oil & Gas Production
ROCG,Roth CH Acquisition IV Co. Common Stock,Industrials,Consumer Electronics/Appliances
ROCLW,Roth CH Acquisition V Co. Warrant,Industrials,Consumer Electronics/Appliances
ROG,Rogers Corporation Common Stock,Technology,Industrial Machinery/Components
ROIC,Retail Opportunity Investments Corp. Common Stock (MD),Real Estate,Real Estate Investment Trusts
ROK,Rockwell Automation Inc. Common Stock,Industrials,Industrial Machinery/Components
ROKU,Roku Inc. Class A Common Stock,Telecommunications,Cable & Other Pay Television Services
ROL,Rollins Inc. Common Stock,Consumer Discretionary,Industrial Specialties
ROOT,Root Inc. Class A Common Stock,Finance,Property-Casualty Insurers
ROP,Roper Technologies Inc. Common Stock,Technology,Computer Software: Prepackaged Software
ROSE,Rose Hill Acquisition Corporation Class A Ordinary Shares,Finance,Blank Checks
ROSEW,Rose Hill Acquisition Corporation Warrant,Finance,Blank Checks
ROST,Ross Stores Inc. Common Stock,Consumer Discretionary,Clothing/Shoe/Accessory Stores
ROVR,Rover Group Inc. Class A Common Stock,Consumer Discretionary,Other Consumer Services
RPAY,Repay Holdings Corporation Class A Common Stock,Technology,EDP Services
RPD,Rapid7 Inc. Common Stock,Technology,Computer Software: Prepackaged Software
RPHM,Reneo Pharmaceuticals Inc. Common Stock,Health Care,Biotechnology: Pharmaceutical Preparations
RPID,Rapid Micro Biosystems Inc. Class A Common Stock,Health Care,Medical Specialities
RPM,RPM International Inc. Common Stock,Consumer Discretionary,Paints/Coatings
RPRX,Royalty Pharma plc Class A Ordinary Shares ,Health Care,Biotechnology: Pharmaceutical Preparations
RPT,RPT Realty Common Stock,Real Estate,Real Estate Investment Trusts
RPTX,Repare Therapeutics Inc. Common Shares,Health Care,Pharmaceuticals and Biotechnology
RQI,Cohen & Steers Quality Income Realty Fund Inc Common Shares,Finance,Trusts Except Educational Religious and Charitable
RRBI,Red River Bancshares Inc. Common Stock,Finance,Commercial Banks
RRC,Range Resources Corporation Common Stock,Energy,Oil & Gas Production
RRGB,Red Robin Gourmet Burgers Inc. Common Stock,Consumer Discretionary,Restaurants
RRR,Red Rock Resorts Inc. Class A Common Stock,Consumer Discretionary,Recreational Games/Products/Toys
RRX,Regal Rexnord Corporation Common Stock,Consumer Discretionary,Metal Fabrications
RS,Reliance Steel & Aluminum Co. Common Stock (DE),Industrials,Steel/Iron Ore
RSG,Republic Services Inc. Common Stock,Utilities,Environmental Services
RSLS,ReShape Lifesciences Inc. Common Stock,Health Care,Biotechnology: Electromedical & Electrotherapeutic Apparatus
RSSS,Research Solutions Inc Common Stock,Technology,Computer Software: Prepackaged Software
RSVR,Reservoir Media Inc. Common Stock,Consumer Discretionary,Movies/Entertainment
RSVRW,Reservoir Media Inc. Warrant,Consumer Discretionary,Movies/Entertainment
RTL,The Necessity Retail REIT Inc. Class A Common Stock,Real Estate,Real Estate Investment Trusts
RTLPO,The Necessity Retail REIT Inc. 7.375% Series C Cumulative Redeemable Preferred Stock,Real Estate,Real Estate Investment Trusts
RTLPP,The Necessity Retail REIT Inc. 7.50% Series A Cumulative Redeemable Perpetual Preferred Stock,Real Estate,Real Estate Investment Trusts
RTX,Raytheon Technologies Corporation Common Stock,Industrials,Military/Government/Technical
RUM,Rumble Inc. Class A Common Stock,Technology,Computer Software: Prepackaged Software
RUMBW,Rumble Inc. Warrant,Technology,Computer Software: Prepackaged Software
RUN,Sunrun Inc. Common Stock,Industrials,Building Products
RUSHA,Rush Enterprises Inc. Common Stock Cl A,Consumer Discretionary,Other Specialty Stores
RUSHB,Rush Enterprises Inc. Class B,Consumer Discretionary,Other Specialty Stores
RUTH,Ruth's Hospitality Group Inc. Common Stock,Consumer Discretionary,Restaurants
RVLP,RVL Pharmaceuticals plc Ordinary Shares,Health Care,Biotechnology: Pharmaceutical Preparations
RVMD,Revolution Medicines Inc. Common Stock,Health Care, Medicinal Chemicals and Botanical Products 
RVNC,Revance Therapeutics Inc. Common Stock,Health Care,Biotechnology: Pharmaceutical Preparations
RVP,Retractable Technologies Inc. Common Stock,Health Care,Medical/Dental Instruments
RVPH,Reviva Pharmaceuticals Holdings Inc. Common Stock ,Health Care,Biotechnology: Pharmaceutical Preparations
RVPHW,Reviva Pharmaceuticals Holdings Inc. Warrants,Health Care,Biotechnology: Pharmaceutical Preparations
RVSB,Riverview Bancorp Inc Common Stock,Finance,Major Banks
RVT,Royce Value Trust Inc. Common Stock,Finance,Trusts Except Educational Religious and Charitable
RVYL,Ryvyl Inc. Common Stock,Technology,EDP Services
RWOD,Redwoods Acquisition Corp. Common Stock,Industrials,Consumer Electronics/Appliances
RWODR,Redwoods Acquisition Corp. Rights,Finance,Blank Checks
RWODW,Redwoods Acquisition Corp. Warrants,Industrials,Consumer Electronics/Appliances
RWT,Redwood Trust Inc. Common Stock,Real Estate,Real Estate Investment Trusts
RXDX,Prometheus Biosciences Inc. Common Stock,Health Care,Biotechnology: Pharmaceutical Preparations
RXRX,Recursion Pharmaceuticals Inc. Class A Common Stock,Health Care,Biotechnology: Pharmaceutical Preparations
RXST,RxSight Inc. Common Stock,Health Care,Biotechnology: Electromedical & Electrotherapeutic Apparatus
RXT,Rackspace Technology Inc. Common Stock,Technology,EDP Services
RYAM,Rayonier Advanced Materials Inc. Common Stock,Industrials,Industrial Specialties
RYI,Ryerson Holding Corporation Common Stock,Industrials,Office Equipment/Supplies/Services
RYN,Rayonier Inc. REIT Common Stock,Real Estate,Real Estate Investment Trusts
RYTM,Rhythm Pharmaceuticals Inc. Common Stock,Health Care,Biotechnology: Pharmaceutical Preparations
RZB,Reinsurance Group of America Incorporated 5.75% Fixed-To-Floating Rate Subordinated Debentures due 2056,Finance,Life Insurance
RZC,Reinsurance Group of America Incorporated 7.125% Fixed-Rate Reset Subordinated Debentures due 2052,Finance,Life Insurance
RZLT,Rezolute Inc. Common Stock (NV),Health Care,Biotechnology: Pharmaceutical Preparations
S,SentinelOne Inc. Class A Common Stock,Technology,EDP Services
SABR,Sabre Corporation Common Stock,Consumer Discretionary,Other Consumer Services
SABRP,Sabre Corporation 6.50% Series A Mandatory Convertible Preferred Stock,Consumer Discretionary,Other Consumer Services
SABS,SAB Biotherapeutics Inc. Common Stock,Health Care,Biotechnology: Pharmaceutical Preparations
SABSW,SAB Biotherapeutics Inc. Warrant,Health Care,Biotechnology: Pharmaceutical Preparations
SACC,Sachem Capital Corp. 6.875% Notes due 2024,Real Estate,Real Estate Investment Trusts
SACH,Sachem Capital Corp. Common Shares,Real Estate,Real Estate Investment Trusts
SAFE,Safehold Inc. Common Stock,Real Estate,Real Estate Investment Trusts
SAFT,Safety Insurance Group Inc. Common Stock,Finance,Property-Casualty Insurers
SAGA,Sagaliam Acquisition Corp. Class A Common Stock,Industrials,Consumer Electronics/Appliances
SAGAR,Sagaliam Acquisition Corp. Rights,Finance,Blank Checks
SAGE,Sage Therapeutics Inc. Common Stock,Health Care,Biotechnology: Pharmaceutical Preparations
SAH,Sonic Automotive Inc. Common Stock,Consumer Discretionary,Other Specialty Stores
SAIA,Saia Inc. Common Stock,Industrials,Trucking Freight/Courier Services
SAJ,Saratoga Investment Corp 8.00% Notes due 2027,Finance,Finance Companies
SAL,Salisbury Bancorp Inc. Common Stock,Finance,Savings Institutions
SALM,Salem Media Group Inc. Class A Common Stock,Consumer Discretionary,Broadcasting
SAM,Boston Beer Company Inc. (The) Common Stock,Consumer Staples,Beverages (Production/Distribution)
SAMA,Schultze Special Purpose Acquisition Corp. II Class A Common Stock,Industrials,Consumer Electronics/Appliances
SAMAU,Schultze Special Purpose Acquisition Corp. II Units,Industrials,Consumer Electronics/Appliances
SAMAW,Schultze Special Purpose Acquisition Corp. II Warrant,Industrials,Consumer Electronics/Appliances
SAMG,Silvercrest Asset Management Group Inc. Class A Common Stock,Finance,Investment Managers
SANA,Sana Biotechnology Inc. Common Stock,Health Care, Medicinal Chemicals and Botanical Products 
SANM,Sanmina Corporation Common Stock,Technology,Electrical Products
SANW,S&W Seed Company Common Stock (NV),Consumer Staples,Farming/Seeds/Milling
SAR,Saratoga Investment Corp New,Finance,Investment Managers
SASI,Sigma Additive Solutions Inc. Common Stock,Technology,EDP Services
SASR,Sandy Spring Bancorp Inc. Common Stock,Finance,Major Banks
SAT,Saratoga Investment Corp 6.00% Notes due 2027,Finance,Finance Companies
SATS,EchoStar  Corporation Common Stock,Technology,Radio And Television Broadcasting And Communications Equipment
SAVA,Cassava Sciences Inc. Common Stock,Health Care,Biotechnology: Pharmaceutical Preparations
SAVE,Spirit Airlines Inc. Common Stock,Consumer Discretionary,Air Freight/Delivery Services
SAY,Saratoga Investment Corp 8.125% Notes due 2027,Finance,Finance Companies
SBAC,SBA Communications Corporation Class A Common Stock,Real Estate,Real Estate Investment Trusts
SBCF,Seacoast Banking Corporation of Florida Common Stock,Finance,Major Banks
SBFG,SB Financial Group Inc. Common Stock,Finance,Major Banks
SBFM,Sunshine Biopharma Inc. Common Stock,Health Care,Biotechnology: Pharmaceutical Preparations
SBFMW,Sunshine Biopharma Inc. Warrant,Health Care,Biotechnology: Pharmaceutical Preparations
SBGI,Sinclair Broadcast Group Inc. Class A Common Stock,Consumer Discretionary,Movies/Entertainment
SBH,Sally Beauty Holdings Inc. (Name to be changed from Sally Holdings Inc.) Common Stock,Miscellaneous,Diversified Commercial Services
SBI,Western Asset Intermediate Muni Fund Inc Common Stock,Finance,Finance/Investors Services
SBIG,SpringBig Holdings Inc. Common Stock,Technology,EDP Services
SBIGW,SpringBig Holdings Inc. Warrant,Technology,EDP Services
SBNY,Signature Bank Common Stock,Finance,Major Banks
SBNYP,Signature Bank Depositary shares each representing a 1/40th ownership interest in a share of 5.000% Noncumulative Perpetual Series A Preferred Stock,Finance,Major Banks
SBR,Sabine Royalty Trust Common Stock,Energy,Oil & Gas Production
SBRA,Sabra Health Care REIT Inc. Common Stock,Real Estate,Real Estate Investment Trusts
SBS,Companhia de saneamento Basico Do Estado De Sao Paulo - Sabesp American Depositary Shares (Each repstg 250 Common Shares),Utilities,Water Supply
SBSI,Southside Bancshares Inc. Common Stock,Finance,Major Banks
SBT,Sterling Bancorp Inc. Common Stock,Finance,Savings Institutions
SBUX,Starbucks Corporation Common Stock,Consumer Discretionary,Beverages - Non-Alcoholic
SCAQ,Stratim Cloud Acquisition Corp. Class A Common Stock,Industrials,Consumer Electronics/Appliances
SCAQU,Stratim Cloud Acquisition Corp. Unit,Industrials,Consumer Electronics/Appliances
SCAQW,Stratim Cloud Acquisition Corp. Warrant,Industrials,Consumer Electronics/Appliances
SCCB,Sachem Capital Corp. 7.125% Notes due 2024,Real Estate,Real Estate Investment Trusts
SCCC,Sachem Capital Corp. 7.75% Notes due 2025,Real Estate,Real Estate Investment Trusts
SCCD,Sachem Capital Corp. 6.00% Notes due 2026,Real Estate,Real Estate Investment Trusts
SCCE,Sachem Capital Corp. 6.00% Notes due 2027,Real Estate,Real Estate Investment Trusts
SCCF,Sachem Capital Corp. 7.125% Notes due 2027,Real Estate,Real Estate Investment Trusts
SCCG,Sachem Capital Corp. 8.00% Notes due 2027,Real Estate,Real Estate Investment Trusts
SCCO,Southern Copper Corporation Common Stock,Basic Materials,Metal Mining
SCD,LMP Capital and Income Fund Inc. Common Stock,Finance,Trusts Except Educational Religious and Charitable
SCHL,Scholastic Corporation Common Stock,Consumer Discretionary,Books
SCHN,Schnitzer Steel Industries Inc. Class A Common Stock,Industrials,Steel/Iron Ore
SCHW,Charles Schwab Corporation (The) Common Stock,Finance,Investment Bankers/Brokers/Service
SCI,Service Corporation International Common Stock,Consumer Discretionary,Other Consumer Services
SCKT,Socket Mobile Inc. Common Stock,Technology,Computer Manufacturing
SCL,Stepan Company Common Stock,Consumer Discretionary,Package Goods/Cosmetics
SCLX,Scilex Holding Company Common Stock,Health Care,Biotechnology: Pharmaceutical Preparations
SCLXW,Scilex Holding Company Warrant,Health Care,Biotechnology: Pharmaceutical Preparations
SCM,Stellus Capital Investment Corporation Common Stock,Finance,Finance/Investors Services
SCOR,comScore Inc. Common Stock,Consumer Discretionary,Business Services
SCPH,scPharmaceuticals Inc. Common Stock,Health Care,Biotechnology: Pharmaceutical Preparations
SCPL,SciPlay Corporation Class A Common Stock,Technology,Computer Software: Prepackaged Software
SCRM,Screaming Eagle Acquisition Corp. Class A Ordinary Shares,Finance,Blank Checks
SCRMU,Screaming Eagle Acquisition Corp. Unit,Finance,Blank Checks
SCRMW,Screaming Eagle Acquisition Corp. Warrant,Finance,Blank Checks
SCS,Steelcase Inc. Common Stock,Consumer Discretionary,Office Equipment/Supplies/Services
SCSC,ScanSource Inc. Common Stock,Technology,Retail: Computer Software & Peripheral Equipment
SCTL,Societal CDMO Inc. Common Stock,Health Care,Biotechnology: Pharmaceutical Preparations
SCU,Sculptor Capital Management Inc. Class A Common Stock,Finance,Investment Managers
SCVL,Shoe Carnival Inc. Common Stock,Consumer Discretionary,Clothing/Shoe/Accessory Stores
SCWO,374Water Inc. Common Stock,Utilities,Environmental Services
SCWX,SecureWorks Corp. Class A Common Stock,Technology,EDP Services
SCX,L.S. Starrett Company (The) Common Stock,Consumer Discretionary,Home Furnishings
SCYX,SCYNEXIS Inc. Common Stock,Health Care,Biotechnology: Pharmaceutical Preparations
SDAC,Sustainable Development Acquisition I Corp. Class A Common Stock,Industrials,Consumer Electronics/Appliances
SDACU,Sustainable Development Acquisition I Corp. Unit,Industrials,Consumer Electronics/Appliances
SDACW,Sustainable Development Acquisition I Corp. Warrant,Industrials,Consumer Electronics/Appliances
SDC,SmileDirectClub Inc. Class A Common Stock,Health Care,Medical/Dental Instruments
SDGR,Schrodinger Inc. Common Stock,Technology,Computer Software: Prepackaged Software
SDIG,Stronghold Digital Mining Inc. Class A Common Stock,Finance,Investment Bankers/Brokers/Service
SE,Sea Limited American Depositary Shares each representing one Class A Ordinary Share,Technology,Computer Software: Prepackaged Software
SEAC,SeaChange International Inc. Common Stock,Technology,Radio And Television Broadcasting And Communications Equipment
SEAS,SeaWorld Entertainment Inc. Common Stock,Consumer Discretionary,Movies/Entertainment
SEAT,Vivid Seats Inc. Class A Common Stock,Industrials,Industrial Machinery/Components
SEATW,Vivid Seats Inc. Warrant,Industrials,Industrial Machinery/Components
SEB,Seaboard Corporation Common Stock,Industrials,Consumer Electronics/Appliances
SEE,Sealed Air Corporation Common Stock,Industrials,Containers/Packaging
SEEL,Seelos Therapeutics Inc. Common Stock,Health Care,Biotechnology: Pharmaceutical Preparations
SEER,Seer Inc. Class A Common Stock,Health Care, Medicinal Chemicals and Botanical Products 
SEIC,SEI Investments Company Common Stock,Finance,Investment Bankers/Brokers/Service
SELB,Selecta Biosciences Inc. Common Stock,Health Care,Biotechnology: Pharmaceutical Preparations
SELF,Global Self Storage Inc. Common Stock,Real Estate,Real Estate Investment Trusts
SEM,Select Medical Holdings Corporation Common Stock,Health Care,Hospital/Nursing Management
SENEA,Seneca Foods Corp. Class A Common Stock,Consumer Staples,Packaged Foods
SENEB,Seneca Foods Corp. Class B Common Stock,Consumer Staples,Packaged Foods
SENS,Senseonics Holdings Inc. Common Stock,Health Care,Biotechnology: Electromedical & Electrotherapeutic Apparatus
SEPAW,SEP Acquisition Corp Warrants,Industrials,Consumer Electronics/Appliances
SERA,Sera Prognostics Inc. Class A Common Stock,Health Care,Precision Instruments
SESN,Sesen Bio Inc. Common Stock,Health Care,Biotechnology: Pharmaceutical Preparations
SEVN,Seven Hills Realty Trust Common Stock,Real Estate,Real Estate Investment Trusts
SF,Stifel Financial Corporation Common Stock,Finance,Investment Bankers/Brokers/Service
SFB,Stifel Financial Corporation 5.20% Senior Notes due 2047,Finance,Investment Bankers/Brokers/Service
SFBC,Sound Financial Bancorp Inc. Common Stock,Finance,Savings Institutions
SFBS,ServisFirst Bancshares Inc. Common Stock,Finance,Major Banks
SFE,Safeguard Scientifics Inc. Common Stock,Finance,Finance/Investors Services
SFIX,Stitch Fix Inc. Class A Common Stock,Consumer Discretionary,Apparel
SFM,Sprouts Farmers Market Inc. Common Stock,Consumer Discretionary,Specialty Foods
SFNC,Simmons First National Corporation Class A Common Stock,Finance,Major Banks
SFST,Southern First Bancshares Inc. Common Stock,Finance,Major Banks
SFT,Shift Technologies Inc. Class A Common Stock,Consumer Discretionary,Other Specialty Stores
SGA,Saga Communications Inc. Class A Common Stock (FL),Consumer Discretionary,Broadcasting
SGBX,Safe & Green Holdings Corp. Common Stock,Industrials,Metal Fabrications
SGEN,Seagen Inc. Common Stock,Health Care,Biotechnology: Biological Products (No Diagnostic Substances)
SGH,SMART Global Holdings Inc. Ordinary Shares,Technology,Semiconductors
SGHT,Sight Sciences Inc. Common Stock,Health Care,Medical Specialities
SGII,Seaport Global Acquisition II Corp. Class A Common Stock,Industrials,Consumer Electronics/Appliances
SGIIW,Seaport Global Acquisition II Corp. Warrants,Industrials,Consumer Electronics/Appliances
SGLY,Singularity Future Technology Ltd. Common Stock,Consumer Discretionary,Oil Refining/Marketing
SGMA,SigmaTron International Inc. Common Stock,Technology,Electrical Products
SGML,Sigma Lithium Corporation Common Shares,Industrials,Industrial Machinery/Components
SGMO,Sangamo Therapeutics Inc. Common Stock,Health Care,Biotechnology: Biological Products (No Diagnostic Substances)
SGRP,SPAR Group Inc. Common Stock,Consumer Discretionary,Business Services
SGRY,Surgery Partners Inc. Common Stock,Health Care,Managed Health Care
SGTX,Sigilon Therapeutics Inc. Common Stock,Health Care, Medicinal Chemicals and Botanical Products 
SGU,Star Group L.P. Common Stock,Utilities,Oil Refining/Marketing
SHAK,Shake Shack Inc. Class A Common Stock,Consumer Discretionary,Restaurants
SHBI,Shore Bancshares Inc Common Stock,Finance,Major Banks
SHC,Sotera Health Company Common Stock,Health Care,Medical Specialities
SHCR,Sharecare Inc. Class A Common Stock,Technology,Computer Software: Prepackaged Software
SHCRW,Sharecare Inc. Warrant,Technology,Computer Software: Prepackaged Software
SHEN,Shenandoah Telecommunications Co Common Stock,Telecommunications,Telecommunications Equipment
SHFS,SHF Holdings Inc. Class A Common Stock,Finance,Major Banks
SHFSW,SHF Holdings Inc. Warrants,Finance,Major Banks
SHLS,Shoals Technologies Group Inc. Class A Common Stock,Technology,Semiconductors
SHO,Sunstone Hotel Investors Inc. Sunstone Hotel Investors Inc. Common Shares,Real Estate,Real Estate Investment Trusts
SHOO,Steven Madden Ltd. Common Stock,Consumer Discretionary,Shoe Manufacturing
SHPH,Shuttle Pharmaceuticals Holdings Inc. Common Stock,Health Care,Biotechnology: Pharmaceutical Preparations
SHW,Sherwin-Williams Company (The) Common Stock,Consumer Discretionary,Paints/Coatings
SHYF,The Shyft Group Inc. Common Stock,Consumer Discretionary,Auto Manufacturing
SIBN,SI-BONE Inc. Common Stock,Health Care,Biotechnology: Electromedical & Electrotherapeutic Apparatus
SID,Companhia Siderurgica Nacional S.A. Common Stock,Industrials,Steel/Iron Ore
SIEB,Siebert Financial Corp. Common Stock,Finance,Investment Bankers/Brokers/Service
SIEN,Sientra Inc. Common Stock,Health Care,Medical Electronics
SIF,SIFCO Industries Inc. Common Stock,Industrials,Office Equipment/Supplies/Services
SIGA,SIGA Technologies Inc. Common Stock,Health Care,Biotechnology: Pharmaceutical Preparations
SIGI,Selective Insurance Group Inc. Common Stock,Finance,Property-Casualty Insurers
SIGIP,Selective Insurance Group Inc. Depositary Shares each representing a 1/1000th interest in a share of 4.60% Non-Cumulative Preferred Stock Series B,Finance,Property-Casualty Insurers
SILK,Silk Road Medical Inc. Common Stock,Health Care,Medical/Dental Instruments
SILO,Silo Pharma Inc. Common Stock,Health Care,Biotechnology: Commercial Physical & Biological Resarch
SIM,Grupo Simec S.A.B. de C.V. American Depositary Shares,Industrials,Steel/Iron Ore
SINT,SiNtx Technologies Inc. Common Stock,Health Care,Industrial Specialties
SIRI,Sirius XM Holdings Inc. Common Stock,Consumer Discretionary,Movies/Entertainment
SITC,SITE Centers Corp. Common Stock,Real Estate,Real Estate Investment Trusts
SITM,SiTime Corporation Common Stock,Technology,Semiconductors
SIVB,SVB Financial Group Common Stock,Finance,Major Banks
SIVBP,SVB Financial Group Depositary Shs each representing a 1/40th interest in a share of 5.25% Fixed-Rate Non-Cumulative Perpetual Preferred Stock Series A,Finance,Major Banks
SIX,Six Flags Entertainment Corporation New Common Stock,Consumer Discretionary,Movies/Entertainment
SJM,J.M. Smucker Company (The) New Common Stock,Consumer Staples,Packaged Foods
SJT,San Juan Basin Royalty Trust Common Stock,Energy,Oil & Gas Production
SJW,SJW Group Common Stock (DE),Utilities,Water Supply
SKGR,SK Growth Opportunities Corporation Class A Common Stock,Finance,Blank Checks
SKGRW,SK Growth Opportunities Corporation Warrant,Finance,Blank Checks
SKIN,The Beauty Health Company Class A Common Stock,Consumer Discretionary,Package Goods/Cosmetics
SKT,Tanger Factory Outlet Centers Inc. Common Stock,Real Estate,Real Estate Investment Trusts
SKWD,Skyward Specialty Insurance Group Inc. Common Stock,Finance,Property-Casualty Insurers
SKX,Skechers U.S.A. Inc. Common Stock,Consumer Discretionary,Shoe Manufacturing
SKY,Skyline Champion Corporation Common Stock,Consumer Discretionary,Homebuilding
SKYA,Skydeck Acquisition Corp. Class A Ordinary Shares,Finance,Blank Checks
SKYAU,Skydeck Acquisition Corp. Units,Finance,Blank Checks
SKYAW,Skydeck Acquisition Corp. Warrants,Finance,Blank Checks
SKYT,SkyWater Technology Inc. Common Stock,Technology,Semiconductors
SKYW,SkyWest Inc. Common Stock,Consumer Discretionary,Air Freight/Delivery Services
