Symbol,Name,Sector,Industry
JKHY,Jack Henry & Associates Inc. Common Stock,Technology,Retail: Computer Software & Peripheral Equipment
JLL,Jones Lang LaSalle Incorporated Common Stock,Finance,Real Estate
JLS,Nuveen Mortgage and Income Fund,Finance,Investment Managers
JMM,Nuveen Multi-Market Income Fund (MA),Finance,Trusts Except Educational Religious and Charitable
JMSB,John Marshall Bancorp Inc. Common Stock,Finance,Major Banks
JNCE,Jounce Therapeutics Inc. Common Stock,Health Care,Biotechnology: Pharmaceutical Preparations
JNJ,Johnson & Johnson Common Stock,Health Care,Biotechnology: Pharmaceutical Preparations
JNPR,Juniper Networks Inc. Common Stock,Technology,Computer peripheral equipment
JOAN,JOANN Inc. Common Stock,Consumer Discretionary,Department/Specialty Retail Stores
JOB,GEE Group Inc. Common Stock,Consumer Discretionary,Diversified Commercial Services
JOBY,Joby Aviation Inc. Common Stock,Consumer Discretionary,Aerospace
JOE,St. Joe Company (The) Common Stock,Real Estate,Homebuilding
JOF,Japan Smaller Capitalization Fund Inc Common Stock,Finance,Trusts Except Educational Religious and Charitable
JOUT,Johnson Outdoors Inc. Class A Common Stock,Consumer Discretionary,Recreational Games/Products/Toys
JPC,Nuveen Preferred & Income Opportunities Fund,Finance,Investment Managers
JPM,JP Morgan Chase & Co. Common Stock,Finance,Major Banks
JPS,Nuveen Preferred & Income Securities Fund,Finance,Investment Managers
JPT,Nuveen Preferred and Income Fund Common Shares of Beneficial Interest,Finance,Trusts Except Educational Religious and Charitable
JQC,Nuveen Credit Strategies Income Fund Shares of Beneficial Interest,Finance,Finance Companies
JRI,Nuveen Real Asset Income and Growth Fund Common Shares of Beneficial Interest,Finance,Finance Companies
JRO,Nuveen Floating Rate Income Opportuntiy Fund Shares of Beneficial Interest,Finance,Investment Managers
JRS,Nuveen Real Estate Income Fund Common Shares of Beneficial Interest,Finance,Finance/Investors Services
JRSH,Jerash Holdings (US) Inc. Common Stock,Consumer Discretionary,Industrial Specialties
JSD,Nuveen Short Duration Credit Opportunities Fund Common Shares of Beneficial Interest,Finance,Finance Companies
JSM,Navient Corporation 6% Senior Notes due December 15 2043,Finance,Finance: Consumer Services
JSPR,Jasper Therapeutics Inc. Common Stock,Health Care,Biotechnology: Pharmaceutical Preparations
JSPRW,Japer Therapeutics Inc. Warrants,Health Care,Biotechnology: Pharmaceutical Preparations
JUPW,Jupiter Wellness Inc. Common Stock,Health Care,Biotechnology: Pharmaceutical Preparations
JUPWW,Jupiter Wellness Inc. Warrant,Health Care,Biotechnology: Pharmaceutical Preparations
JVA,Coffee Holding Co. Inc. Common Stock,Consumer Staples,Specialty Foods
JWAC,Jupiter Wellness Acquisition Corp. Class A Common Stock,Industrials,Consumer Electronics/Appliances
JWACR,Jupiter Wellness Acquisition Corp. Right,Finance,Blank Checks
JWN,Nordstrom Inc. Common Stock,Consumer Discretionary,Clothing/Shoe/Accessory Stores
K,Kellogg Company Common Stock,Consumer Staples,Packaged Foods
KA,Kineta Inc. Common Stock,Health Care,Biotechnology: Pharmaceutical Preparations
KAI,Kadant Inc Common Stock,Technology,Industrial Machinery/Components
KALA,Kala Pharmaceuticals Inc. Common Stock,Health Care,Biotechnology: Pharmaceutical Preparations
KALU,Kaiser Aluminum Corporation Common Stock,Industrials,Aluminum
KAMN,Kaman Corporation Common Stock,Industrials,Military/Government/Technical
KAVL,Kaival Brands Innovations Group Inc. Common Stock,Health Care, Medicinal Chemicals and Botanical Products 
KBAL,Kimball International Inc. Class B Common Stock,Consumer Discretionary,Industrial Specialties
KBNT,Kubient Inc. Common Stock,Technology,EDP Services
KBNTW,Kubient Inc. Warrant,Technology,EDP Services
KBR,KBR Inc. Common Stock,Industrials,Oilfield Services/Equipment
KDNY,Chinook Therapeutics Inc. Common Stock,Health Care,Biotechnology: Pharmaceutical Preparations
KDP,Keurig Dr Pepper Inc. Common Stock,Consumer Staples,Beverages (Production/Distribution)
KE,Kimball Electronics Inc. Common Stock,Technology,Industrial Machinery/Components
KELYA,Kelly Services Inc. Class A Common Stock,Consumer Discretionary,Diversified Commercial Services
KELYB,Kelly Services Inc. Class B Common Stock,Consumer Discretionary,Diversified Commercial Services
KEQU,Kewaunee Scientific Corporation Common Stock,Industrials,Medical Specialities
KERN,Akerna Corp. Common Stock,Health Care,Managed Health Care
KERNW,Akerna Corp Warrant,Health Care,Managed Health Care
KEX,Kirby Corporation Common Stock,Consumer Discretionary,Marine Transportation
KEY,KeyCorp Common Stock,Finance,Major Banks
KEYS,Keysight Technologies Inc. Common Stock,Industrials,Industrial Machinery/Components
KF,Korea Fund Inc. (The) New Common Stock,Finance,Investment Managers
KFFB,Kentucky First Federal Bancorp Common Stock,Finance,Savings Institutions
KFRC,Kforce Inc. Common Stock,Consumer Discretionary,Diversified Commercial Services
KFY,Korn Ferry Common Stock,Consumer Discretionary,Diversified Commercial Services
KHC,The Kraft Heinz Company Common Stock,Consumer Staples,Farming/Seeds/Milling
KIDS,OrthoPediatrics Corp. Common Stock,Health Care,Medical/Dental Instruments
KIM,Kimco Realty Corporation (HC) Common Stock,Real Estate,Real Estate Investment Trusts
KIND,Nextdoor Holdings Inc. Class A Common Stock,Consumer Discretionary,EDP Services
KINS,Kingstone Companies Inc. Common Stock,Finance,Specialty Insurers
KINZ,KINS Technology Group Inc. Class A Common Stock,Industrials,Consumer Electronics/Appliances
KINZU,KINS Technology Group Inc. Unit,Industrials,Consumer Electronics/Appliances
KINZW,KINS Technology Group Inc. Warrant,Industrials,Consumer Electronics/Appliances
KIRK,Kirkland's Inc. COMMONSTOCK,Miscellaneous,Diversified Commercial Services
KITT,Nauticus Robotics Inc. Common stock,Industrials,Metal Fabrications
KITTW,Nauticus Robotics Inc. Warrant,Industrials,Metal Fabrications
KKR,KKR & Co. Inc. Common Stock,Finance,Investment Managers
KLAC,KLA Corporation Common Stock,Technology,Electronic Components
KLR,Kaleyra Inc. Common Stock,Technology,Retail: Computer Software & Peripheral Equipment
KLTR,Kaltura Inc. Common Stock,Technology,EDP Services
KLXE,KLX Energy Services Holdings Inc. Common Stock,Energy,Oilfield Services/Equipment
KMB,Kimberly-Clark Corporation Common Stock,Consumer Discretionary,Paper
KMI,Kinder Morgan Inc. Common Stock,Utilities,Natural Gas Distribution
KMPB,Kemper Corporation 5.875% Fixed-Rate Reset Junior Subordinated Debentures due 2062,Finance,Life Insurance
KMPR,Kemper Corporation,Finance,Property-Casualty Insurers
KMT,Kennametal Inc. Common Stock,Industrials,Industrial Machinery/Components
KMX,CarMax Inc,Consumer Discretionary,Other Specialty Stores
KNSA,Kiniksa Pharmaceuticals Ltd. Class A Common Stock,Health Care,Biotechnology: Pharmaceutical Preparations
KNSL,Kinsale Capital Group Inc. Common Stock,Finance,Property-Casualty Insurers
KNTE,Kinnate Biopharma Inc. Common Stock,Health Care,Biotechnology: Pharmaceutical Preparations
KNTK,Kinetik Holdings Inc. Class A Common Stock,Energy,Oil & Gas Production
KNX,Knight-Swift Transportation Holdings Inc.,Industrials,Trucking Freight/Courier Services
KO,Coca-Cola Company (The) Common Stock,Consumer Staples,Beverages (Production/Distribution)
KOD,Kodiak Sciences Inc Common Stock,Health Care,Biotechnology: Pharmaceutical Preparations
KODK,Eastman Kodak Company Common New,Consumer Discretionary,Business Services
KOF,Coca Cola Femsa S.A.B. de C.V.  American Depositary Shares each representing 10 Units (each Unit consists of 3 Series B Shares and 5 Series L Shares),Consumer Staples,Beverages (Production/Distribution)
KOP,Koppers Holdings Inc. Koppers Holdings Inc. Common Stock,Industrials,Industrial Specialties
KOPN,Kopin Corporation Common Stock,Technology,Industrial Machinery/Components
KOSS,Koss Corporation Common Stock,Consumer Staples,Consumer Electronics/Appliances
KPLT,Katapult Holdings Inc. Common Stock,Technology,EDP Services
KPLTW,Katapult Holdings Inc. Warrant,Technology,EDP Services
KPRX,Kiora Pharmaceuticals Inc.  Common Stock,Health Care,Biotechnology: In Vitro & In Vivo Diagnostic Substances
KPTI,Karyopharm Therapeutics Inc. Common Stock,Miscellaneous,Diversified Commercial Services
KR,Kroger Company (The) Common Stock,Consumer Staples,Food Chains
KRBP,Kiromic BioPharma Inc. Common Stock,Health Care, Medicinal Chemicals and Botanical Products 
KRC,Kilroy Realty Corporation Common Stock,Real Estate,Real Estate Investment Trusts
KREF,KKR Real Estate Finance Trust Inc. Common Stock,Real Estate,Real Estate Investment Trusts
KRG,Kite Realty Group Trust Common Stock,Real Estate,Real Estate Investment Trusts
KRMD,KORU Medical Systems Inc. Common Stock,Health Care,Medical/Dental Instruments
KRNL,Kernel Group Holdings Inc. Class A Ordinary Shares,Finance,Blank Checks
KRNLU,Kernel Group Holdings Inc. Units,Finance,Blank Checks
KRNLW,Kernel Group Holdings Inc. Warrants,Finance,Blank Checks
KRNY,Kearny Financial Corp Common Stock,Finance,Savings Institutions
KRO,Kronos Worldwide Inc Common Stock,Industrials,Major Chemicals
KRON,Kronos Bio Inc. Common Stock,Health Care, Medicinal Chemicals and Botanical Products 
KROS,Keros Therapeutics Inc. Common Stock,Health Care, Medicinal Chemicals and Botanical Products 
KRP,Kimbell Royalty Partners Common Units Representing Limited Partner Interests,Energy,Oil & Gas Production
KRT,Karat Packaging Inc. Common Stock,Industrials,Office Equipment/Supplies/Services
KRTX,Karuna Therapeutics Inc. Common Stock,Health Care,Biotechnology: Pharmaceutical Preparations
KRUS,Kura Sushi USA Inc. Class A Common Stock,Consumer Discretionary,Restaurants
KRYS,Krystal Biotech Inc. Common Stock,Health Care,Biotechnology: Biological Products (No Diagnostic Substances)
KSCP,Knightscope Inc. Class A Common Stock,Technology,Security Systems Services
KSI,Kadem Sustainable Impact Corporation Class A common stock,Industrials,Consumer Electronics/Appliances
KSICW,Kadem Sustainable Impact Corporation Warrant,Industrials,Consumer Electronics/Appliances
KSM,DWS Strategic Municipal Income Trust,Finance,Trusts Except Educational Religious and Charitable
KSPN,Kaspien Holdings Inc. Common Stock,Technology,Retail: Computer Software & Peripheral Equipment
KSS,Kohl's Corporation Common Stock,Consumer Discretionary,Department/Specialty Retail Stores
KTCC,Key Tronic Corporation Common Stock,Technology,Computer peripheral equipment
KTF,DWS Municipal Income Trust,Finance,Finance Companies
KTH,Structures Products Cp 8% CorTS Issued by Peco Energy Cap Tr II Preferred Stock,Finance,Investment Managers
KTOS,Kratos Defense & Security Solutions Inc. Common Stock,Consumer Discretionary,Ordnance And Accessories
KTRA,Kintara Therapeutics Inc. Common Stock,Health Care,Biotechnology: Pharmaceutical Preparations
KTTA,Pasithea Therapeutics Corp. Common Stock,Health Care,Biotechnology: Pharmaceutical Preparations
KTTAW,Pasithea Therapeutics Corp. Warrant,Health Care,Biotechnology: Pharmaceutical Preparations
KURA,Kura Oncology Inc. Common Stock,Health Care,Biotechnology: Biological Products (No Diagnostic Substances)
KVHI,KVH Industries Inc. Common Stock,Technology,Radio And Television Broadcasting And Communications Equipment
KVSA,Khosla Ventures Acquisition Co. Class A Common Stock,Industrials,Consumer Electronics/Appliances
KVSC,Khosla Ventures Acquisition Co. III Class A Common Stock,Industrials,Consumer Electronics/Appliances
KW,Kennedy-Wilson Holdings Inc. Common Stock,Real Estate,Real Estate
KWR,Quaker Houghton Common Stock,Industrials,Automotive Aftermarket
KYCHU,Keyarch Acquisition Corporation Unit,Finance,Blank Checks
KYMR,Kymera Therapeutics Inc. Common Stock,Health Care, Medicinal Chemicals and Botanical Products 
KYN,Kayne Anderson Energy Infrastructure Fund Inc.,Finance,Finance/Investors Services
KZR,Kezar Life Sciences Inc. Common Stock,Health Care,Biotechnology: Pharmaceutical Preparations
L,Loews Corporation Common Stock,Finance,Property-Casualty Insurers
LAB,Standard BioTools Inc. Common Stock,Industrials,Biotechnology: Laboratory Analytical Instruments
LABP,Landos Biopharma Inc. Common Stock,Health Care, Medicinal Chemicals and Botanical Products 
LAD,Lithia Motors Inc. Common Stock,Consumer Discretionary,Other Specialty Stores
LAMR,Lamar Advertising Company Class A Common Stock,Real Estate,Real Estate Investment Trusts
LANC,Lancaster Colony Corporation Common Stock,Consumer Staples,Packaged Foods
LAND,Gladstone Land Corporation Common Stock,Real Estate,Real Estate Investment Trusts
LANDM,Gladstone Land Corporation 5.00% Series D Cumulative Term Preferred Stock,Real Estate,Real Estate Investment Trusts
LANDO,Gladstone Land Corporation 6.00% Series B Cumulative Redeemable Preferred Stock,Real Estate,Real Estate Investment Trusts
LARK,Landmark Bancorp Inc. Common Stock,Finance,Major Banks
LASE,Laser Photonics Corporation Common Stock,Industrials,Industrial Machinery/Components
LASR,nLIGHT Inc. Common Stock,Technology,Semiconductors
LATG,LatAmGrowth SPAC Class A Ordinary Shares,Finance,Blank Checks
LATGU,LatAmGrowth SPAC Unit,Finance,Blank Checks
LATGW,LatAmGrowth SPAC Warrants,Finance,Blank Checks
LAUR,Laureate Education Inc. Common Stock,Consumer Discretionary,Service to the Health Industry
LAW,CS Disco Inc. Common Stock,Technology,Computer Software: Prepackaged Software
LAZR,Luminar Technologies Inc.  Class A Common Stock,Consumer Discretionary,Auto Parts:O.E.M.
LAZY,Lazydays Holdings Inc. Common Stock,Consumer Discretionary,Other Specialty Stores
LBAI,Lakeland Bancorp Inc. Common Stock,Finance,Major Banks
LBBB,Lakeshore Acquisition II Corp. Ordinary Shares,Finance,Blank Checks
LBBBR,Lakeshore Acquisition II Corp. Rights,Finance,Blank Checks
LBBBU,Lakeshore Acquisition II Corp. Unit,Finance,Blank Checks
LBBBW,Lakeshore Acquisition II Corp. Warrants,Finance,Blank Checks
LBC,Luther Burbank Corporation Common Stock,Finance,Commercial Banks
LBPH,Longboard Pharmaceuticals Inc. Common Stock,Health Care,Biotechnology: Pharmaceutical Preparations
LBRDA,Liberty Broadband Corporation Class A Common Stock,Consumer Discretionary,Telecommunications Equipment
LBRDK,Liberty Broadband Corporation Class C Common Stock,Consumer Discretionary,Telecommunications Equipment
LBRDP,Liberty Broadband Corporation Series A Cumulative Redeemable Preferred Stock,Consumer Discretionary,Telecommunications Equipment
LBRT,Liberty Energy Inc. Class A common stock,Energy,Oilfield Services/Equipment
LC,LendingClub Corporation Common Stock,Finance,Finance Companies
LCA,Landcadia Holdings IV Inc. Class A Common Stock,Industrials,Consumer Electronics/Appliances
LCAHU,Landcadia Holdings IV Inc. Units,Industrials,Consumer Electronics/Appliances
LCAHW,Landcadia Holdings IV Inc. Warrant ,Industrials,Consumer Electronics/Appliances
LCI,Lannett Co Inc Common Stock,Health Care,Biotechnology: Pharmaceutical Preparations
LCID,Lucid Group Inc. Common Stock,Consumer Discretionary,Auto Manufacturing
LCII,LCI Industries,Consumer Discretionary,Auto Parts:O.E.M.
LCNB,LCNB Corporation Common Stock,Finance,Major Banks
LCTX,Lineage Cell Therapeutics Inc. Common Stock,Health Care,Biotechnology: Biological Products (No Diagnostic Substances)
LCUT,Lifetime Brands Inc. Common Stock,Consumer Discretionary,Home Furnishings
LDHA,LDH Growth Corp I Class A Ordinary Shares,Finance,Blank Checks
LDHAU,LDH Growth Corp I Units,Finance,Blank Checks
LDHAW,LDH Growth Corp I Warrant,Finance,Blank Checks
LDOS,Leidos Holdings Inc. Common Stock,Technology,EDP Services
LDP,Cohen & Steers Limited Duration Preferred and Income Fund Inc.,Finance,Finance Companies
LE,Lands' End Inc. Common Stock,Consumer Discretionary,Clothing/Shoe/Accessory Stores
LEA,Lear Corporation Common Stock,Consumer Discretionary,Auto Parts:O.E.M.
LECO,Lincoln Electric Holdings Inc. Common Shares,Industrials,Industrial Machinery/Components
LEE,Lee Enterprises Incorporated Common Stock,Consumer Discretionary,Newspapers/Magazines
LEG,Leggett & Platt Incorporated Common Stock,Consumer Discretionary,Home Furnishings
LEGA,Lead Edge Growth Opportunities Ltd Class A Ordinary Shares,Finance,Blank Checks
LEGAU,Lead Edge Growth Opportunities Ltd Units,Finance,Blank Checks
LEGAW,Lead Edge Growth Opportunities Ltd Warrant,Finance,Blank Checks
LEGH,Legacy Housing Corporation Common Stock (TX),Consumer Discretionary,Homebuilding
LEGN,Legend Biotech Corporation American Depositary Shares,Health Care,Biotechnology: Pharmaceutical Preparations
LEN,Lennar Corporation Class A Common Stock,Real Estate,Building operators
LEO,BNY Mellon Strategic Municipals Inc. Common Stock,Finance,Trusts Except Educational Religious and Charitable
LESL,Leslie's Inc. Common Stock,Miscellaneous,Diversified Commercial Services
LEVI,Levi Strauss & Co Class A Common Stock,Consumer Discretionary,Industrial Specialties
LEXX,Lexaria Bioscience Corp. Common Stock,Health Care,Biotechnology: Pharmaceutical Preparations
LEXXW,Lexaria Bioscience Corp. Warrant,Health Care,Biotechnology: Pharmaceutical Preparations
LFAC,LF Capital Acquisition Corp. II Class A Common Stock,Industrials,Consumer Electronics/Appliances
LFACU,LF Capital Acquisition Corp. II Units,Industrials,Consumer Electronics/Appliances
LFACW,LF Capital Acquisition Corp. II Warrants,Industrials,Consumer Electronics/Appliances
LFCR,Lifecore Biomedical Inc. Common Stock,Health Care,Biotechnology: Pharmaceutical Preparations
LFLY,Leafly Holdings Inc. Common Stock,Consumer Staples,Retail-Drug Stores and Proprietary Stores
LFMD,LifeMD Inc. Common Stock,Miscellaneous,Diversified Commercial Services
LFMDP,LifeMD Inc. 8.875% Series A Cumulative Perpetual Preferred Stock,Miscellaneous,Diversified Commercial Services
LFST,LifeStance Health Group Inc. Common Stock,Health Care,Hospital/Nursing Management
LFT,Lument Finance Trust Inc. Common Stock,Real Estate,Real Estate Investment Trusts
LFUS,Littelfuse Inc. Common Stock,Technology,Electronic Components
LFVN,Lifevantage Corporation Common Stock (Delaware),Consumer Staples,Farming/Seeds/Milling
LGIH,LGI Homes Inc. Common Stock,Consumer Discretionary,Homebuilding
LGL,LGL Group Inc. (The) Common Stock,Technology,Industrial Machinery/Components
LGMK,LogicMark Inc. Common Stock,Consumer Discretionary,Diversified Commercial Services
LGND,Ligand Pharmaceuticals Incorporated Common Stock,Health Care,Biotechnology: Pharmaceutical Preparations
LGST,Semper Paratus Acquisition Corporation Class A Ordinary Shares,Finance,Blank Checks
LGSTU,Semper Paratus Acquisition Corporation Unit,Finance,Blank Checks
LGSTW,Semper Paratus Acquisition Corporation Warrant,Finance,Blank Checks
LGVN,Longeveron Inc. Class A Common Stock,Health Care, Medicinal Chemicals and Botanical Products 
LH,Laboratory Corporation of America Holdings Common Stock,Health Care,Medical Specialities
LHX,L3Harris Technologies Inc. Common Stock,Industrials,Industrial Machinery/Components
LIAN,LianBio American Depositary Shares,Health Care,Biotechnology: Pharmaceutical Preparations
LIBY,Liberty Resources Acquisition Corp. Class A Common Stock,Industrials,Consumer Electronics/Appliances
LIBYW,Liberty Resources Acquisition Corp. Warrant,Industrials,Consumer Electronics/Appliances
LIDR,AEye Inc. Class A Common Stock,Consumer Discretionary,Auto Parts:O.E.M.
LIDRW,AEye Inc. Warrant,Consumer Discretionary,Auto Parts:O.E.M.
LIFE,aTyr Pharma Inc. Common Stock,Health Care,Biotechnology: Biological Products (No Diagnostic Substances)
LIFW,MSP Recovery Inc. Class A Common Stock,Technology,Computer Software: Prepackaged Software
LIFWW,MSP Recovery Inc. Warrant,Technology,Computer Software: Prepackaged Software
LII,Lennox International Inc. Common Stock,Industrials,Industrial Machinery/Components
LILA,Liberty Latin America Ltd. Class A Common Stock,Telecommunications,Cable & Other Pay Television Services
LILAK,Liberty Latin America Ltd. Class C Common Stock,Telecommunications,Cable & Other Pay Television Services
LINC,Lincoln Educational Services Corporation Common Stock,Consumer Discretionary,Service to the Health Industry
LINK,Interlink Electronics Inc. Common Stock,Technology,Industrial Machinery/Components
LION,Lionheart III Corp Class A Common Stock,Industrials,Consumer Electronics/Appliances
LIONU,Lionheart III Corp Unit,Industrials,Consumer Electronics/Appliances
LIONW,Lionheart III Corp Warrant,Industrials,Consumer Electronics/Appliances
LIPO,Lipella Pharmaceuticals Inc. Common Stock,Health Care,Biotechnology: Pharmaceutical Preparations
LITE,Lumentum Holdings Inc. Common Stock,Technology,Computer peripheral equipment
LITT,Logistics Innovation Technologies Corp. Class A Common Stock,Industrials,Consumer Electronics/Appliances
LITTU,Logistics Innovation Technologies Corp. Units,Industrials,Consumer Electronics/Appliances
LITTW,Logistics Innovation Technologies Corp. Warrant,Industrials,Consumer Electronics/Appliances
LIVB,LIV Capital Acquisition Corp. II Class A Ordinary Shares,Finance,Blank Checks
LIVBW,LIV Capital Acquisition Corp. II Warrants,Finance,Blank Checks
LIVE,Live Ventures Incorporated Common Stock,Consumer Discretionary,Home Furnishings
LIXT,Lixte Biotechnology Holdings Inc. Common Stock,Health Care,Biotechnology: Pharmaceutical Preparations
LIXTW,Lixte Biotechnology Holdings Inc. Warrants,Health Care,Biotechnology: Pharmaceutical Preparations
LKFN,Lakeland Financial Corporation Common Stock,Finance,Major Banks
LKQ,LKQ Corporation Common Stock,Consumer Discretionary,Automotive Aftermarket
LL,LL Flooring Holdings Inc. Common Stock,Consumer Discretionary,RETAIL: Building Materials
LLY,Eli Lilly and Company Common Stock,Health Care,Biotechnology: Pharmaceutical Preparations
LMAT,LeMaitre Vascular Inc. Common Stock,Health Care,Medical/Dental Instruments
LMB,Limbach Holdings Inc. Common Stock,Consumer Discretionary,Military/Government/Technical
LMFA,LM Funding America Inc. Common Stock,Finance,Finance: Consumer Services
LMND,Lemonade Inc. Common Stock,Finance,Property-Casualty Insurers
LMNL,Liminal BioSciences Inc. Common Shares,Health Care,Pharmaceuticals and Biotechnology
LMNR,Limoneira Co Common Stock,Consumer Staples,Farming/Seeds/Milling
LMST,Limestone Bancorp Inc. Common Stock,Finance,Major Banks
LMT,Lockheed Martin Corporation Common Stock,Industrials,Aerospace
LNC,Lincoln National Corporation Common Stock,Finance,Life Insurance
LND,Brasilagro Brazilian Agric Real Estate Co Sponsored ADR (Brazil),Consumer Staples,Farming/Seeds/Milling
LNG,Cheniere Energy Inc. Common Stock,Utilities,Oil/Gas Transmission
LNN,Lindsay Corporation Common Stock,Industrials,Industrial Machinery/Components
LNSR,LENSAR Inc. Common Stock,Health Care,Medical Electronics
LNT,Alliant Energy Corporation Common Stock,Utilities,Power Generation
LNTH,Lantheus Holdings Inc. Common Stock,Health Care,Biotechnology: Pharmaceutical Preparations
LNW,Light & Wonder Inc. Common Stock,Consumer Discretionary,Movies/Entertainment
LOAN,Manhattan Bridge Capital Inc,Real Estate,Real Estate Investment Trusts
LOB,Live Oak Bancshares Inc. Common Stock,Finance,Commercial Banks
LOCO,El Pollo Loco Holdings Inc. Common Stock,Consumer Discretionary,Restaurants
LODE,Comstock Inc. Common Stock,Finance,Real Estate
LOGI,Logitech International S.A. Ordinary Shares,Technology,Computer peripheral equipment
LOMA,Loma Negra Compania Industrial Argentina Sociedad Anonima ADS,Industrials,Building Materials
LOPE,Grand Canyon Education Inc. Common Stock,Consumer Discretionary,Service to the Health Industry
LOW,Lowe's Companies Inc. Common Stock,Consumer Discretionary,RETAIL: Building Materials
LPCN,Lipocine Inc. Common Stock,Health Care,Biotechnology: Pharmaceutical Preparations
LPLA,LPL Financial Holdings Inc. Common Stock,Finance,Investment Bankers/Brokers/Service
LPRO,Open Lending Corporation Class A Common Stock,Finance,Finance: Consumer Services
LPSN,LivePerson Inc. Common Stock,Technology,EDP Services
LPTH,LightPath Technologies Inc. Class A Common Stock,Technology,Electronic Components
LPTX,Leap Therapeutics Inc. Common Stock,Health Care,Biotechnology: Biological Products (No Diagnostic Substances)
LQDA,Liquidia Corporation Common Stock,Health Care,Biotechnology: Biological Products (No Diagnostic Substances)
LQDT,Liquidity Services Inc. Common Stock,Consumer Discretionary,Catalog/Specialty Distribution
LRCX,Lam Research Corporation Common Stock,Technology,Industrial Machinery/Components
LRFC,Logan Ridge Finance Corporation Common Stock,Finance,Trusts Except Educational Religious and Charitable
LRMR,Larimar Therapeutics Inc. Common Stock,Health Care,Biotechnology: Pharmaceutical Preparations
LRN,Stride Inc. Common Stock,Consumer Discretionary,Other Consumer Services
LSBK,Lake Shore Bancorp Inc. Common Stock,Finance,Savings Institutions
LSCC,Lattice Semiconductor Corporation Common Stock,Technology,Semiconductors
LSDI,Lucy Scientific Discovery Inc. Common Stock,Health Care,Pharmaceuticals and Biotechnology
LSI,Life Storage Inc. Common Stock,Real Estate,Real Estate Investment Trusts
LSTA,Lisata Therapeutics Inc. Common Stock,Health Care,Managed Health Care
LSTR,Landstar System Inc. Common Stock,Industrials,Trucking Freight/Courier Services
LSXMA,Liberty Media Corporation Series A Liberty SiriusXM Common Stock,Consumer Discretionary,Broadcasting
LSXMB,Liberty Media Corporation Series B Liberty SiriusXM Common Stock,Consumer Discretionary,Broadcasting
LSXMK,Liberty Media Corporation Series C Liberty SiriusXM Common Stock,Consumer Discretionary,Broadcasting
LTBR,Lightbridge Corporation Common Stock,Consumer Discretionary,Business Services
LTC,LTC Properties Inc. Common Stock,Real Estate,Real Estate Investment Trusts
LTCH,Latch Inc. Common Stock,Technology,EDP Services
LTCHW,Latch Inc. Warrant expiring 6/4/2026,Technology,EDP Services
