Symbol,Name,Sector,Industry
CPF,Central Pacific Financial Corp New,Finance,Major Banks
CPHC,Canterbury Park Holding Corporation 'New' Common Stock,Consumer Discretionary,Services-Misc. Amusement & Recreation
CPIX,Cumberland Pharmaceuticals Inc. Common Stock,Health Care,Biotechnology: Pharmaceutical Preparations
CPK,Chesapeake Utilities Corporation Common Stock,Utilities,Oil & Gas Production
CPRT,Copart Inc. (DE) Common Stock,Consumer Discretionary,Other Specialty Stores
CPRX,Catalyst Pharmaceuticals Inc. Common Stock,Health Care,Biotechnology: Pharmaceutical Preparations
CPS,Cooper-Standard Holdings Inc. Common Stock,Consumer Discretionary,Auto Parts:O.E.M.
CPSI,Computer Programs and Systems Inc. Common Stock,Technology,EDP Services
CPSS,Consumer Portfolio Services Inc. Common Stock,Finance,Diversified Financial Services
CPT,Camden Property Trust Common Stock,Real Estate,Real Estate Investment Trusts
CPTN,Cepton Inc. Common Stock,Technology,Computer Software: Prepackaged Software
CPTNW,Cepton Inc. Warrant,Technology,Computer Software: Prepackaged Software
CPZ,Calamos Long/Short Equity & Dynamic Income Trust Common Stock,Finance,Trusts Except Educational Religious and Charitable
CQP,Cheniere Energy Partners LP Cheniere Energy Partners LP Common Units,Utilities,Oil/Gas Transmission
CR,Crane Holdings Co. Common Stock,Industrials,Office Equipment/Supplies/Services
CRAI,CRA International Inc. Common Stock,Consumer Discretionary,Other Consumer Services
CRBP,Corbus Pharmaceuticals Holdings Inc. Common Stock,Health Care,Biotechnology: Pharmaceutical Preparations
CRBU,Caribou Biosciences Inc. Common Stock,Health Care, Medicinal Chemicals and Botanical Products 
CRCT,Cricut Inc. Class A Common Stock,Industrials,Wholesale Distributors
CRDF,Cardiff Oncology Inc. Common Stock,Health Care,Biotechnology: Biological Products (No Diagnostic Substances)
CRDL,Cardiol Therapeutics Inc. Class A Common Shares,Health Care,Pharmaceuticals and Biotechnology
CRDO,Credo Technology Group Holding Ltd Ordinary Shares,Technology,Semiconductors
CREC,Crescera Capital Acquisition Corp Class A Ordinary Shares,Finance,Blank Checks
CRECU,Crescera Capital Acquisition Corp Unit,Finance,Blank Checks
CRECW,Crescera Capital Acquisition Corp Warrant,Finance,Blank Checks
CRESW,Cresud S.A.C.I.F. y A. Warrant,Finance,Real Estate
CRESY,Cresud S.A.C.I.F. y A. American Depositary Shares,Finance,Real Estate
CREX,Creative Realities Inc. Common Stock,Technology,EDP Services
CREXW,Creative Realities Inc. Warrant,Technology,EDP Services
CRF,Cornerstone Total Return Fund Inc. (The) Common Stock,Finance,Finance/Investors Services
CRGE,Charge Enterprises Inc. Common Stock,Consumer Discretionary,Telecommunications Equipment
CRI,Carter's Inc. Common Stock,Consumer Discretionary,Department/Specialty Retail Stores
CRIS,Curis Inc. Common Stock,Health Care,Biotechnology: Biological Products (No Diagnostic Substances)
CRK,Comstock Resources Inc. Common Stock,Energy,Oil & Gas Production
CRL,Charles River Laboratories International Inc. Common Stock,Consumer Discretionary,EDP Services
CRM,Salesforce Inc. Common Stock,Technology,Computer Software: Prepackaged Software
CRMD,CorMedix Inc. Common Stock,Health Care,Biotechnology: Pharmaceutical Preparations
CRMT,America's Car-Mart Inc Common Stock,Consumer Discretionary,Other Specialty Stores
CRNC,Cerence Inc. Common Stock,Technology,EDP Services
CRNX,Crinetics Pharmaceuticals Inc. Common Stock,Health Care,Biotechnology: Pharmaceutical Preparations
CRON,Cronos Group Inc. Common Share,Health Care,Pharmaceuticals and Biotechnology
CROX,Crocs Inc. Common Stock,Consumer Discretionary,Shoe Manufacturing
CRS,Carpenter Technology Corporation Common Stock,Industrials,Steel/Iron Ore
CRSR,Corsair Gaming Inc. Common Stock,Technology,Computer Manufacturing
CRT,Cross Timbers Royalty Trust Common Stock,Energy,Oil & Gas Production
CRUS,Cirrus Logic Inc. Common Stock,Technology,Semiconductors
CRVL,CorVel Corp. Common Stock,Finance,Specialty Insurers
CRVS,Corvus Pharmaceuticals Inc. Common Stock,Health Care,Biotechnology: Pharmaceutical Preparations
CRWD,CrowdStrike Holdings Inc. Class A Common Stock,Technology,EDP Services
CRZN,Corazon Capital V838 Monoceros Corp Class A Ordinary Shares,Finance,Blank Checks
CRZNU,Corazon Capital V838 Monoceros Corp Unit,Finance,Blank Checks
CRZNW,Corazon Capital V838 Monoceros Corp Warrant,Finance,Blank Checks
CSBR,Champions Oncology Inc. Common Stock,Health Care,Biotechnology: Biological Products (No Diagnostic Substances)
CSCO,Cisco Systems Inc. Common Stock (DE),Telecommunications,Computer Communications Equipment
CSGP,CoStar Group Inc. Common Stock,Finance,Real Estate
CSGS,CSG Systems International Inc. Common Stock,Technology,EDP Services
CSII,Cardiovascular Systems Inc. Common Stock,Health Care,Medical/Dental Instruments
CSLM,Consilium Acquisition Corp I Ltd. Class A Ordinary Share,Finance,Blank Checks
CSLMW,Consilium Acquisition Corp I Ltd. Warrant,Finance,Blank Checks
CSPI,CSP Inc. Common Stock,Technology,EDP Services
CSQ,Calamos Strategic Total Return Common Stock,Finance,Finance Companies
CSR,D/B/A Centerspace Common Stock,Real Estate,Real Estate Investment Trusts
CSSE,Chicken Soup for the Soul Entertainment Inc. Class A Common Stock,Consumer Discretionary,Movies/Entertainment
CSSEL,Chicken Soup for the Soul Entertainment Inc. Warrant,Consumer Discretionary,Movies/Entertainment
CSSEN,Chicken Soup for the Soul Entertainment Inc. 9.50% Notes due 2025,Consumer Discretionary,Movies/Entertainment
CSSEP,Chicken Soup for the Soul Entertainment Inc. 9.75% Series A Cumulative Redeemable Perpetual Preferred Stock,Consumer Discretionary,Movies/Entertainment
CSTL,Castle Biosciences Inc. Common Stock,Health Care,Medical Specialities
CSTR,CapStar Financial Holdings Inc. Common Stock,Finance,Major Banks
CSV,Carriage Services Inc. Common Stock,Consumer Discretionary,Other Consumer Services
CSWC,Capital Southwest Corporation Common Stock,Finance,Finance/Investors Services
CSWI,CSW Industrials Inc. Common Stock,Industrials,Home Furnishings
CSX,CSX Corporation Common Stock,Industrials,Railroads
CTAS,Cintas Corporation Common Stock,Consumer Discretionary,Business Services
CTBI,Community Trust Bancorp Inc. Common Stock,Finance,Major Banks
CTG,Computer Task Group Inc. Common Stock,Technology,EDP Services
CTHR,Charles & Colvard Ltd Common Stock,Consumer Discretionary,Consumer Specialties
CTIB,Yunhong CTI Ltd. Common Stock,Miscellaneous,Diversified Commercial Services
CTIC,CTI BioPharma Corp. (DE) Common Stock,Health Care,Biotechnology: Pharmaceutical Preparations
CTKB,Cytek Biosciences Inc. Common Stock,Health Care,Biotechnology: Electromedical & Electrotherapeutic Apparatus
CTLP,Cantaloupe Inc. Common Stock,Technology,EDP Services
CTLT,Catalent Inc. Common Stock,Health Care,Biotechnology: Pharmaceutical Preparations
CTMX,CytomX Therapeutics Inc. Common Stock,Health Care,Biotechnology: Pharmaceutical Preparations
CTO,CTO Realty Growth Inc. Common Stock,Real Estate,Real Estate Investment Trusts
CTR,ClearBridge MLP and Midstream Total Return Fund Inc. Common Stock,Finance,Investment Managers
CTRA,Coterra Energy Inc. Common Stock,Energy,Oil & Gas Production
CTRE,CareTrust REIT Inc. Common Stock,Real Estate,Real Estate Investment Trusts
CTS,CTS Corporation Common Stock,Technology,Industrial Machinery/Components
CTSH,Cognizant Technology Solutions Corporation Class A Common Stock,Technology,EDP Services
CTSO,Cytosorbents Corporation Common Stock,Health Care,Medical/Dental Instruments
CTXR,Citius Pharmaceuticals Inc. Common Stock,Health Care,Biotechnology: Pharmaceutical Preparations
CUBA,Herzfeld Caribbean Basin Fund Inc. (The) Common Stock,Finance,Investment Managers
CUBB,Customers Bancorp Inc 5.375% Subordinated Notes Due 2034,Finance,Major Banks
CUBE,CubeSmart Common Shares,Real Estate,Real Estate Investment Trusts
CUBI,Customers Bancorp Inc Common Stock,Finance,Major Banks
CUE,Cue Biopharma Inc. Common Stock,Health Care,Biotechnology: Pharmaceutical Preparations
CUEN,Cuentas Inc. Common Stock,Technology,Computer Software: Prepackaged Software
CUENW,Cuentas Inc. Warrant,Technology,Computer Software: Prepackaged Software
CULL,Cullman Bancorp Inc. Common Stock,Finance,Savings Institutions
CULP,Culp Inc. Common Stock,Consumer Discretionary,Textiles
CURI,CuriosityStream Inc. Class A Common Stock,Industrials,Broadcasting
CURIW,CuriosityStream Inc. Warrant,Industrials,Broadcasting
CUTR,Cutera Inc. Common Stock,Health Care,Biotechnology: Electromedical & Electrotherapeutic Apparatus
CUZ,Cousins Properties Incorporated Common Stock,Real Estate,Real Estate Investment Trusts
CVBF,CVB Financial Corporation Common Stock,Finance,Major Banks
CVCO,Cavco Industries Inc. Common Stock When Issued,Consumer Discretionary,Homebuilding
CVCY,Central Valley Community Bancorp Common Stock,Finance,Major Banks
CVGI,Commercial Vehicle Group Inc. Common Stock,Consumer Discretionary,Auto Parts:O.E.M.
CVGW,Calavo Growers Inc. Common Stock,Consumer Discretionary,Specialty Foods
CVI,CVR Energy Inc. Common Stock,Energy,Integrated oil Companies
CVKD,Cadrenal Therapeutics Inc. Common Stock,Health Care, Medicinal Chemicals and Botanical Products 
CVLG,Covenant Logistics Group Inc. Class A Common Stock,Industrials,Trucking Freight/Courier Services
CVLT,Commvault Systems Inc. Common Stock,Technology,Computer Software: Prepackaged Software
CVLY,Codorus Valley Bancorp Inc Common Stock,Finance,Savings Institutions
CVM,Cel-Sci Corporation Common Stock,Health Care,Biotechnology: Biological Products (No Diagnostic Substances)
CVNA,Carvana Co. Class A Common Stock,Consumer Discretionary,Other Specialty Stores
CVR,Chicago Rivet & Machine Co. Common Stock,Consumer Discretionary,Industrial Specialties
CVRX,CVRx Inc. Common Stock,Health Care,Biotechnology: Electromedical & Electrotherapeutic Apparatus
CVS,CVS Health Corporation Common Stock,Health Care,Managed Health Care
CVT,Cvent Holding Corp. Common Stock,Technology,Computer Software: Prepackaged Software
CVU,CPI Aerostructures Inc. Common Stock,Industrials,Military/Government/Technical
CVV,CVD Equipment Corporation Common Stock,Technology,Industrial Machinery/Components
CVX,Chevron Corporation Common Stock,Energy,Integrated oil Companies
CWBC,Community West Bancshares Common Stock,Finance,Major Banks
CWBR,CohBar Inc. Common Stock,Health Care,Biotechnology: In Vitro & In Vivo Diagnostic Substances
CWEN,Clearway Energy Inc. Class C Common Stock,Utilities,Electric Utilities: Central
CWH,Camping World Holdings Inc. Class A Common Stock,Consumer Discretionary,Other Specialty Stores
CWST,Casella Waste Systems Inc. Class A Common Stock,Utilities,Environmental Services
CWT,California Water Service Group Common Stock,Utilities,Water Supply
CX,Cemex S.A.B. de C.V. Sponsored ADR,Industrials,Building Materials
CXDO,Crexendo Inc. Common Stock,Consumer Discretionary,Telecommunications Equipment
CXE,MFS High Income Municipal Trust Common Stock,Finance,Investment Managers
CXH,MFS Investment Grade Municipal Trust Common Stock,Finance,Investment Managers
CYAN,Cyanotech Corporation Common Stock,Consumer Staples,Farming/Seeds/Milling
CYCC,Cyclacel Pharmaceuticals Inc. Common Stock,Health Care,Biotechnology: Pharmaceutical Preparations
CYCCP,Cyclacel Pharmaceuticals Inc. 6% Convertible Preferred Stock,Health Care,Biotechnology: Pharmaceutical Preparations
CYCN,Cyclerion Therapeutics Inc. Common Stock,Health Care,Biotechnology: Pharmaceutical Preparations
CYH,Community Health Systems Inc. Common Stock,Health Care,Hospital/Nursing Management
CYN,Cyngn Inc. Common Stock,Technology,EDP Services
CYT,Cyteir Therapeutics Inc. Common Stock,Health Care,Biotechnology: Pharmaceutical Preparations
CYTH,Cyclo Therapeutics Inc. Common Stock,Health Care,Biotechnology: Pharmaceutical Preparations
CYTHW,Cyclo Therapeutics Inc. Warrant,Health Care,Biotechnology: Pharmaceutical Preparations
CYTK,Cytokinetics Incorporated Common Stock,Health Care,Biotechnology: Pharmaceutical Preparations
CYXT,Cyxtera Technologies Inc. Class A Common Stock,Technology,EDP Services
CZFS,Citizens Financial Services Inc. Common Stock,Finance,Major Banks
CZNC,Citizens & Northern Corp Common Stock,Finance,Major Banks
CZR,Caesars Entertainment Inc. Common Stock,Consumer Discretionary,Hotels/Resorts
CZWI,Citizens Community Bancorp Inc. Common Stock,Finance,Savings Institutions
D,Dominion Energy Inc. Common Stock,Utilities,Electric Utilities: Central
DAIO,Data I/O Corporation Common Stock,Technology,Industrial Machinery/Components
DAKT,Daktronics Inc. Common Stock,Industrials,Office Equipment/Supplies/Services
DAL,Delta Air Lines Inc. Common Stock,Consumer Discretionary,Air Freight/Delivery Services
DALN,DallasNews Corporation Series A Common Stock,Consumer Discretionary,Newspapers/Magazines
DALS,DA32 Life Science Tech Acquisition Corp. Class A Common Stock,Industrials,Consumer Electronics/Appliances
DAN,Dana Incorporated Common Stock ,Consumer Discretionary,Auto Parts:O.E.M.
DAR,Darling Ingredients Inc. Common Stock,Consumer Staples,Farming/Seeds/Milling
DARE,Dare Bioscience Inc. Common Stock,Health Care,Biotechnology: Pharmaceutical Preparations
DATS,DatChat Inc. Common Stock,Technology,Computer Software: Prepackaged Software
DATSW,DatChat Inc. Series A Warrant,Technology,Computer Software: Prepackaged Software
DAVE,Dave Inc. Class A Common Stock,Technology,Retail: Computer Software & Peripheral Equipment
DAVEW,Dave Inc. Warrants,Technology,Retail: Computer Software & Peripheral Equipment
DAWN,Day One Biopharmaceuticals Inc. Common Stock,Health Care,Biotechnology: Pharmaceutical Preparations
DBD,Diebold Nixdorf Incorporated Common Stock,Technology,EDP Services
DBGI,Digital Brands Group Inc. Common Stock,Consumer Discretionary,Apparel
DBGIW,Digital Brands Group Inc. Warrant,Consumer Discretionary,Apparel
DBI,Designer Brands Inc. Class A Common Stock,Consumer Discretionary,Clothing/Shoe/Accessory Stores
DBRG,DigitalBridge Group Inc.,Real Estate,Building operators
DBTX,Decibel Therapeutics Inc. Common Stock,Health Care,Biotechnology: Pharmaceutical Preparations
DBX,Dropbox Inc. Class A Common Stock,Technology,Computer Software: Prepackaged Software
DCGO,DocGo Inc. Common Stock,Health Care,Managed Health Care
DCI,Donaldson Company Inc. Common Stock,Industrials,Pollution Control Equipment
DCO,Ducommun Incorporated Common Stock,Industrials,Military/Government/Technical
DCOM,Dime Community Bancshares Inc. Common Stock,Finance,Savings Institutions
DCOMP,Dime Community Bancshares Inc. Fixed-Rate Non-Cumulative Perpetual Preferred Stock Series A,Finance,Savings Institutions
DCP,DCP Midstream  LP Common Units ,Utilities,Natural Gas Distribution
DCPH,Deciphera Pharmaceuticals Inc. Common Stock,Health Care,Biotechnology: Pharmaceutical Preparations
DCT,Duck Creek Technologies Inc. Common Stock,Technology,Retail: Computer Software & Peripheral Equipment
DCTH,Delcath Systems Inc. Common Stock,Health Care,Medical Specialities
DDD,3D Systems Corporation Common Stock,Technology,Computer peripheral equipment
DDF,Delaware Investments Dividend & Income Fund Inc. Common Stock,Finance,Finance Companies
DDOG,Datadog Inc. Class A Common Stock,Technology,EDP Services
DDS,Dillard's Inc. Common Stock,Consumer Discretionary,Department/Specialty Retail Stores
DDT,Dillard's Capital Trust I,Consumer Discretionary,Department/Specialty Retail Stores
DE,Deere & Company Common Stock,Industrials,Industrial Machinery/Components
DEA,Easterly Government Properties Inc. Common Stock,Real Estate,Real Estate Investment Trusts
DECA,Denali Capital Acquisition Corp. Class A Ordinary Shares,Finance,Blank Checks
DECK,Deckers Outdoor Corporation Common Stock,Consumer Discretionary,Shoe Manufacturing
DEI,Douglas Emmett Inc. Common Stock,Real Estate,Real Estate Investment Trusts
DENN,Denny's Corporation Common Stock,Consumer Discretionary,Restaurants
DERM,Journey Medical Corporation Common Stock,Health Care,Biotechnology: Pharmaceutical Preparations
DEX,Delaware Enhanced Global Dividend Common Shares of Beneficial Interest,Finance,Finance Companies
DFFN,Diffusion Pharmaceuticals Inc. Common Stock,Health Care,Biotechnology: Pharmaceutical Preparations
DFLI,Dragonfly Energy Holdings Corp. Common Stock,Technology,Electronic Components
DFLIW,Dragonfly Energy Holdings Corp. Warrant,Technology,Electronic Components
DFS,Discover Financial Services Common Stock,Finance,Finance: Consumer Services
DG,Dollar General Corporation Common Stock,Consumer Discretionary,Department/Specialty Retail Stores
DGICA,Donegal Group Inc. Class A Common Stock,Finance,Property-Casualty Insurers
DGICB,Donegal Group Inc. Class B Common Stock,Finance,Property-Casualty Insurers
DGII,Digi International Inc. Common Stock,Technology,Computer peripheral equipment
DGLY,Digital Ally Inc. Common Stock,Technology,Security Systems Services
DGNU,Dragoneer Growth Opportunities Corp. III Class A Ordinary Shares,Finance,Blank Checks
DGX,Quest Diagnostics Incorporated Common Stock,Health Care,Medical Specialities
DH,Definitive Healthcare Corp. Class A Common Stock,Technology,Computer Software: Prepackaged Software
DHAC,Digital Health Acquisition Corp. Common Stock,Industrials,Consumer Electronics/Appliances
DHACW,Digital Health Acquisition Corp. Warrant,Industrials,Consumer Electronics/Appliances
DHC,Diversified Healthcare Trust Common Shares of Beneficial Interest,Real Estate,Real Estate Investment Trusts
DHCA,DHC Acquisition Corp. Class A ordinary share,Finance,Blank Checks
DHCAU,DHC Acquisition Corp. Unit,Finance,Blank Checks
DHCAW,DHC Acquisition Corp. Warrant,Finance,Blank Checks
DHCNI,Diversified Healthcare Trust 5.625% Senior Notes due 2042,Real Estate,Real Estate Investment Trusts
DHCNL,Diversified Healthcare Trust 6.25% Senior Notes Due 2046,Real Estate,Real Estate Investment Trusts
DHF,BNY Mellon High Yield Strategies Fund Common Stock,Finance,Finance Companies
DHHC,DiamondHead Holdings Corp. Class A Common Stock,Industrials,Consumer Electronics/Appliances
DHHCW,DiamondHead Holdings Corp. Warrant,Industrials,Consumer Electronics/Appliances
DHIL,Diamond Hill Investment Group Inc. Class A Common Stock,Finance,Investment Managers
DHR,Danaher Corporation Common Stock,Health Care,Medical Specialities
DHX,DHI Group Inc. Common Stock,Technology,Computer Software: Prepackaged Software
DHY,Credit Suisse High Yield Bond Fund Common Stock,Finance,Finance/Investors Services
DIBS,1stdibs.com Inc. Common Stock,Miscellaneous,Diversified Commercial Services
DICE,DICE Therapeutics Inc. Common Stock,Health Care,Biotechnology: Pharmaceutical Preparations
DIN,Dine Brands Global Inc. Common Stock,Consumer Discretionary,Restaurants
DINO,HF Sinclair Corporation Common Stock,Energy,Integrated oil Companies
DIOD,Diodes Incorporated Common Stock,Technology,Semiconductors
DIS,Walt Disney Company (The) Common Stock,Consumer Discretionary,Movies/Entertainment
DISA,Disruptive Acquisition Corporation I Class A Ordinary Shares,Finance,Blank Checks
DISAU,Disruptive Acquisition Corporation I Unit,Finance,Blank Checks
DISAW,Disruptive Acquisition Corporation I Warrant,Finance,Blank Checks
DISH,DISH Network Corporation Class A Common Stock,Consumer Discretionary,Telecommunications Equipment
DIT,AMCON Distributing Company Common Stock,Consumer Discretionary,Food Distributors
DJCO,Daily Journal Corp. (S.C.) Common Stock,Technology,Retail: Computer Software & Peripheral Equipment
DK,Delek US Holdings Inc. Common Stock,Energy,Integrated oil Companies
DKL,Delek Logistics Partners L.P. Common Units representing Limited Partner Interests,Energy,Oil & Gas Production
DKNG,DraftKings Inc. Class A Common Stock,Consumer Discretionary,Services-Misc. Amusement & Recreation
DKS,Dick's Sporting Goods Inc Common Stock,Consumer Discretionary,Other Specialty Stores
DLA,Delta Apparel Inc. Common Stock,Consumer Discretionary,Department/Specialty Retail Stores
DLB,Dolby Laboratories Common Stock,Technology,EDP Services
DLHC,DLH Holdings Corp.,Consumer Discretionary,Business Services
DLPN,Dolphin Entertainment Inc. Common Stock,Consumer Discretionary,Advertising
DLR,Digital Realty Trust Inc. Common Stock,Real Estate,Real Estate Investment Trusts
DLTH,Duluth Holdings Inc. Class B Common Stock,Consumer Discretionary,Department/Specialty Retail Stores
DLTR,Dollar Tree Inc. Common Stock,Consumer Discretionary,Department/Specialty Retail Stores
DLX,Deluxe Corporation Common Stock,Consumer Discretionary,Advertising
DMAC,DiaMedica Therapeutics Inc. Common Stock,Health Care,Pharmaceuticals and Biotechnology
DMF,BNY Mellon Municipal Income Inc. Common Stock,Finance,Finance/Investors Services
DMLP,Dorchester Minerals L.P. Common Units Representing Limited Partnership Interests,Energy,Oil & Gas Production
DMO,Western Asset Mortgage Opportunity Fund Inc. Common Stock,Finance,Trusts Except Educational Religious and Charitable
DMRC,Digimarc Corporation Common Stock,Technology,EDP Services
DMS,Digital Media Solutions Inc. Class A Ordinary Shares,Consumer Discretionary,Advertising
DMTK,DermTech Inc. Common Stock,Health Care,Managed Health Care
DNA,Ginkgo Bioworks Holdings Inc. Class A Common Stock,Health Care,Biotechnology: Biological Products (No Diagnostic Substances)
DNAB,Social Capital Suvretta Holdings Corp. II Class A Ordinary Shares,Finance,Blank Checks
DNAD,Social Capital Suvretta Holdings Corp. IV Class A Ordinary Shares,Finance,Blank Checks
DNB,Dun & Bradstreet Holdings Inc. Common Stock,Technology,Internet and Information Services
DNLI,Denali Therapeutics Inc. Common Stock,Health Care,Biotechnology: Biological Products (No Diagnostic Substances)
DNP,DNP Select Income Fund Inc. Common Stock,Finance,Investment Managers
DNUT,Krispy Kreme Inc. Common Stock,Consumer Discretionary,Specialty Foods
DO,Diamond Offshore Drilling Inc. Common Stock,Energy,Oil & Gas Production
DOC,Physicians Realty Trust Common Shares of Beneficial Interest,Real Estate,Real Estate Investment Trusts
DOCN,DigitalOcean Holdings Inc. Common Stock,Technology,Retail: Computer Software & Peripheral Equipment
DOCU,DocuSign Inc. Common Stock,Technology,EDP Services
DOMH,Dominari Holdings Inc. Common Stock,Health Care, Medicinal Chemicals and Botanical Products 
DOMO,Domo Inc. Class B Common Stock,Technology,Computer Software: Prepackaged Software
DORM,Dorman Products Inc. Common Stock,Consumer Discretionary,Auto Parts:O.E.M.
DOV,Dover Corporation Common Stock,Industrials,Industrial Machinery/Components
DPCS,DP Cap Acquisition Corp I Class A Ordinary Shares,Finance,Blank Checks
DPCSU,DP Cap Acquisition Corp I Unit,Finance,Blank Checks
DPCSW,DP Cap Acquisition Corp I Warrants,Finance,Blank Checks
DPG,Duff & Phelps Utility and Infrastructure Fund Inc.,Finance,Trusts Except Educational Religious and Charitable
DPRO,Draganfly Inc. Common Shares,Consumer Discretionary,Electronic Components
DPZ,Domino's Pizza Inc Common Stock,Consumer Discretionary,Food Distributors
DRCT,Direct Digital Holdings Inc. Class A Common Stock,Consumer Discretionary,Advertising
DRCTW,Direct Digital Holdings Inc. Warrant,Consumer Discretionary,Advertising
DRH,Diamondrock Hospitality Company Common Stock,Real Estate,Real Estate Investment Trusts
DRI,Darden Restaurants Inc. Common Stock,Consumer Discretionary,Restaurants
DRMA,Dermata Therapeutics Inc. Common Stock,Health Care,Biotechnology: Pharmaceutical Preparations
DRMAW,Dermata Therapeutics Inc. Warrant,Health Care,Biotechnology: Pharmaceutical Preparations
DRQ,Dril-Quip Inc. Common Stock,Industrials,Metal Fabrications
DRRX,DURECT Corporation Common Stock,Health Care,Biotechnology: Pharmaceutical Preparations
DRUG,Bright Minds Biosciences Inc. Common Stock,Health Care,Pharmaceuticals and Biotechnology
DSEY,Diversey Holdings Ltd. Ordinary Shares,Consumer Discretionary,Specialty Chemicals
DSGN,Design Therapeutics Inc. Common Stock,Health Care,Biotechnology: Pharmaceutical Preparations
DSGR,Distribution Solutions Group Inc. Common Stock,Industrials,Industrial Machinery/Components
DSM,BNY Mellon Strategic Municipal Bond Fund Inc. Common Stock,Finance,Investment Managers
DSP,Viant Technology Inc. Class A Common Stock,Technology,EDP Services
DSU,Blackrock Debt Strategies Fund Inc. Common Stock,Finance,Finance Companies
DT,Dynatrace Inc. Common Stock,Technology,EDP Services
DTB,DTE Energy Company 2020 Series G 4.375% Junior Subordinated Debentures due 2080,Utilities,Electric Utilities: Central
DTE,DTE Energy Company Common Stock,Utilities,Electric Utilities: Central
DTF,DTF Tax-Free Income 2028 Term Fund Inc. Common Stock,Finance,Investment Managers
DTG,DTE Energy Company 2021 Series E 4.375% Junior Subordinated Debentures,Utilities,Electric Utilities: Central
DTIL,Precision BioSciences Inc. Common Stock,Health Care,Biotechnology: Pharmaceutical Preparations
DTOC,Digital Transformation Opportunities Corp. Class A Common Stock,Industrials,Consumer Electronics/Appliances
DTOCU,Digital Transformation Opportunities Corp. Units,Industrials,Consumer Electronics/Appliances
DTOCW,Digital Transformation Opportunities Corp. Warrant,Industrials,Consumer Electronics/Appliances
DTST,Data Storage Corporation Common Stock,Technology,EDP Services
DTSTW,Data Storage Corporation Warrant,Technology,EDP Services
DTW,DTE Energy Company 2017 Series E 5.25% Junior Subordinated Debentures due 2077,Utilities,Electric Utilities: Central
DUK,Duke Energy Corporation (Holding Company) Common Stock,Utilities,Power Generation
DUKB,Duke Energy Corporation 5.625% Junior Subordinated Debentures due 2078,Utilities,Power Generation
DUNE,Dune Acquisition Corporation Class A Common Stock,Industrials,Consumer Electronics/Appliances
DUNEW,Dune Acquisition Corporation Warrant,Industrials,Consumer Electronics/Appliances
