Symbol,Name,Sector,Industry
A,Agilent Technologies Inc. Common Stock,Industrials,Electrical Products
AACI,Armada Acquisition Corp. I Common Stock,Industrials,Consumer Electronics/Appliances
AACIW,Armada Acquisition Corp. I Warrant,Industrials,Consumer Electronics/Appliances
AADI,Aadi Bioscience Inc. Common Stock,Health Care,Biotechnology: Pharmaceutical Preparations
AAIC,Arlington Asset Investment Corp Class A (new),Real Estate,Real Estate Investment Trusts
AAIN,Arlington Asset Investment Corp 6.000% Senior Notes Due 2026,Finance,Finance/Investors Services
AAL,American Airlines Group Inc. Common Stock,Consumer Discretionary,Air Freight/Delivery Services
AAMC,Altisource Asset Management Corp Com,Finance,Investment Managers
AAME,Atlantic American Corporation Common Stock,Finance,Life Insurance
AAOI,Applied Optoelectronics Inc. Common Stock,Technology,Semiconductors
AAON,AAON Inc. Common Stock,Industrials,Industrial Machinery/Components
AAP,Advance Auto Parts Inc.,Consumer Discretionary,Auto & Home Supply Stores
AAPL,Apple Inc. Common Stock,Technology,Computer Manufacturing
AAT,American Assets Trust Inc. Common Stock,Real Estate,Real Estate Investment Trusts
AAWW,Atlas Air Worldwide Holdings NEW Common Stock,Consumer Discretionary,Transportation Services
AB,AllianceBernstein Holding L.P.  Units,Finance,Investment Managers
ABBV,AbbVie Inc. Common Stock,Health Care,Other Pharmaceuticals
ABC,AmerisourceBergen Corporation Common Stock,Health Care,Other Pharmaceuticals
ABCB,Ameris Bancorp Common Stock,Finance,Major Banks
ABCL,AbCellera Biologics Inc. Common Shares,Health Care,Pharmaceuticals and Biotechnology
ABEO,Abeona Therapeutics Inc. Common Stock,Health Care,Biotechnology: Pharmaceutical Preparations
ABG,Asbury Automotive Group Inc Common Stock,Consumer Discretionary,Other Specialty Stores
ABIO,ARCA biopharma Inc. Common Stock,Health Care,Biotechnology: In Vitro & In Vivo Diagnostic Substances
ABM,ABM Industries Incorporated Common Stock,Consumer Discretionary,Diversified Commercial Services
ABNB,Airbnb Inc. Class A Common Stock,Consumer Discretionary,Hotels/Resorts
ABOS,Acumen Pharmaceuticals Inc. Common Stock,Health Care,Biotechnology: Pharmaceutical Preparations
ABR,Arbor Realty Trust Common Stock,Real Estate,Real Estate Investment Trusts
ABSI,Absci Corporation Common Stock,Health Care,Biotechnology: Pharmaceutical Preparations
ABT,Abbott Laboratories Common Stock,Health Care,Medical/Dental Instruments
ABUS,Arbutus Biopharma Corporation Common Stock,Health Care,Pharmaceuticals and Biotechnology
ABVC,ABVC BioPharma Inc. Common Stock,Health Care,Biotechnology: Pharmaceutical Preparations
AC,Associated Capital Group Inc. Common Stock,Finance,Investment Bankers/Brokers/Service
ACAB,Atlantic Coastal Acquisition Corp. II Class A Common Stock,Industrials,Consumer Electronics/Appliances
ACABU,Atlantic Coastal Acquisition Corp. II Unit,Industrials,Consumer Electronics/Appliances
ACABW,Atlantic Coastal Acquisition Corp. II Warrant,Industrials,Consumer Electronics/Appliances
ACAC,Acri Capital Acquisition Corporation Class A Common Stock,Industrials,Consumer Electronics/Appliances
ACACW,Acri Capital Acquisition Corporation Warrant,Industrials,Consumer Electronics/Appliances
ACAD,ACADIA Pharmaceuticals Inc. Common Stock,Health Care,Biotechnology: Pharmaceutical Preparations
ACAH,Atlantic Coastal Acquisition Corp. Class A Common Stock,Industrials,Consumer Electronics/Appliances
ACAHW,Atlantic Coastal Acquisition Corp. Warrant,Industrials,Consumer Electronics/Appliances
ACAX,Alset Capital Acquisition Corp. Class A Common Stock,Industrials,Consumer Electronics/Appliances
ACAXR,Alset Capital Acquisition Corp. Right,Industrials,Consumer Electronics/Appliances
ACAXW,Alset Capital Acquisition Corp. Warrant,Industrials,Consumer Electronics/Appliances
ACB,Aurora Cannabis Inc. Common Shares,Health Care,Pharmaceuticals and Biotechnology
ACCD,Accolade Inc. Common Stock,Technology,Interactive Media
ACCO,Acco Brands Corporation Common Stock,Consumer Discretionary,Advertising
ACDC,ProFrac Holding Corp. Class A Common Stock,Industrials,Metal Fabrications
ACDCW,ProFrac Holding Corp. Warrant,Industrials,Metal Fabrications
ACEL,Accel Entertainment Inc. ,Consumer Discretionary,Recreational Games/Products/Toys
ACER,Acer Therapeutics Inc. Common Stock (DE),Health Care,Biotechnology: Biological Products (No Diagnostic Substances)
ACET,Adicet Bio Inc. Common Stock ,Health Care,Biotechnology: Pharmaceutical Preparations
ACGN,Aceragen Inc. Common Stock,Health Care,Biotechnology: Biological Products (No Diagnostic Substances)
ACHC,Acadia Healthcare Company Inc. Common Stock,Health Care,Hospital/Nursing Management
ACHR,Archer Aviation Inc. Class A Common Stock,Industrials,Aerospace
ACHV,Achieve Life Sciences Inc. Common Shares,Health Care,Biotechnology: In Vitro & In Vivo Diagnostic Substances
ACI,Albertsons Companies Inc. Class A Common Stock,Consumer Staples,Food Chains
ACIW,ACI Worldwide Inc. Common Stock,Technology,EDP Services
ACLS,Axcelis Technologies Inc. Common Stock,Technology,Industrial Machinery/Components
ACLX,Arcellx Inc. Common Stock,Health Care,Biotechnology: Pharmaceutical Preparations
ACM,AECOM Common Stock,Consumer Discretionary,Military/Government/Technical
ACMR,ACM Research Inc. Class A Common Stock,Technology,Industrial Machinery/Components
ACNB,ACNB Corporation Common Stock,Finance,Major Banks
ACNT,Ascent Industries Co. Common Stock,Industrials,Steel/Iron Ore
ACON,Aclarion Inc. Common Stock,Technology,Retail: Computer Software & Peripheral Equipment
ACONW,Aclarion Inc. Warrant,Technology,Retail: Computer Software & Peripheral Equipment
ACOR,Acorda Therapeutics Inc. Common Stock,Health Care,Biotechnology: Biological Products (No Diagnostic Substances)
ACP,abrdn Income Credit Strategies Fund Common Shares,Finance,Investment Managers
ACQR,Independence Holdings Corp. Class A Ordinary Share,Finance,Blank Checks
ACQRU,Independence Holdings Corp. Units,Finance,Blank Checks
ACQRW,Independence Holdings Corp. Warrant,Finance,Blank Checks
ACR,ACRES Commercial Realty Corp. Common Stock,Real Estate,Real Estate Investment Trusts
ACRE,Ares Commercial Real Estate Corporation Common Stock,Real Estate,Real Estate Investment Trusts
ACRS,Aclaris Therapeutics Inc. Common Stock,Health Care,Biotechnology: Commercial Physical & Biological Resarch
ACRV,Acrivon Therapeutics Inc. Common Stock,Health Care, Medicinal Chemicals and Botanical Products 
ACRX,AcelRx Pharmaceuticals Inc. Common Stock,Health Care, Medicinal Chemicals and Botanical Products 
ACST,Acasti Pharma Inc. Class A Common Stock,Health Care,Pharmaceuticals and Biotechnology
ACT,Enact Holdings Inc. Common Stock,Finance,Specialty Insurers
ACTG,Acacia Research Corporation (Acacia Tech) Common Stock,Miscellaneous,Multi-Sector Companies
ACU,Acme United Corporation. Common Stock,Consumer Discretionary,Home Furnishings
ACV,Virtus Diversified Income & Convertible Fund Common Shares of Beneficial Interest,Finance,Finance/Investors Services
ACVA,ACV Auctions Inc. Class A Common Stock,Industrials,Metal Fabrications
ACXP,Acurx Pharmaceuticals Inc. Common Stock,Health Care,Biotechnology: Pharmaceutical Preparations
ADAL,Anthemis Digital Acquisitions I Corp Class A Ordinary Shares,Finance,Blank Checks
ADALU,Anthemis Digital Acquisitions I Corp Unit,Finance,Blank Checks
ADALW,Anthemis Digital Acquisitions I Corp Warrant,Finance,Blank Checks
ADBE,Adobe Inc. Common Stock,Technology,Computer Software: Prepackaged Software
ADC,Agree Realty Corporation Common Stock,Real Estate,Real Estate Investment Trusts
ADEA,Adeia Inc. Common Stock,Technology,EDP Services
ADER,26 Capital Acquisition Corp. Class A Common Stock,Industrials,Consumer Electronics/Appliances
ADERU,26 Capital Acquisition Corp. Unit,Industrials,Consumer Electronics/Appliances
ADERW,26 Capital Acquisition Corp. Warrant,Industrials,Consumer Electronics/Appliances
ADES,Advanced Emissions Solutions Inc. Common Stock,Industrials,Industrial Specialties
ADI,Analog Devices Inc. Common Stock,Technology,Semiconductors
ADIL,Adial Pharmaceuticals Inc Common Stock,Health Care,Biotechnology: Pharmaceutical Preparations
ADILW,Adial Pharmaceuticals Inc Warrant,Health Care,Biotechnology: Pharmaceutical Preparations
ADMA,ADMA Biologics Inc Common Stock,Health Care,Biotechnology: Pharmaceutical Preparations
ADMP,Adamis Pharmaceuticals Corporation Common Stock,Health Care,Biotechnology: Pharmaceutical Preparations
ADN,Advent Technologies Holdings Inc. Class A Common Stock,Utilities,Power Generation
ADNWW,Advent Technologies Holdings Inc. Warrant,Utilities,Power Generation
ADOC,Edoc Acquisition Corp. Class A Ordinary Share,Health Care,Biotechnology: Biological Products (No Diagnostic Substances)
ADOCR,Edoc Acquisition Corp. Right,Health Care,Biotechnology: Biological Products (No Diagnostic Substances)
ADOCW,Edoc Acquisition Corp. Warrant,Health Care,Biotechnology: Biological Products (No Diagnostic Substances)
ADP,Automatic Data Processing Inc. Common Stock,Consumer Discretionary,Business Services
ADPT,Adaptive Biotechnologies Corporation Common Stock,Health Care,Biotechnology: Biological Products (No Diagnostic Substances)
ADSK,Autodesk Inc. Common Stock,Technology,Computer Software: Prepackaged Software
ADT,ADT Inc. Common Stock,Consumer Discretionary,Diversified Commercial Services
ADTH,AdTheorent Holding Company Inc. Common Stock,Consumer Discretionary,Advertising
ADTHW,AdTheorent Holding Company Inc. Warrants,Consumer Discretionary,Advertising
ADTN,ADTRAN Holdings Inc. Common Stock,Telecommunications,Telecommunications Equipment
ADTX,Aditxt Inc. Common Stock,Health Care, Medicinal Chemicals and Botanical Products 
ADUS,Addus HomeCare Corporation Common Stock,Health Care,Medical/Nursing Services
ADV,Advantage Solutions Inc. Class A Common Stock,Consumer Discretionary,Advertising
ADVM,Adverum Biotechnologies Inc. Common Stock,Health Care,Biotechnology: Pharmaceutical Preparations
ADVWW,Advantage Solutions Inc. Warrant,Consumer Discretionary,Advertising
ADX,Adams Diversified Equity Fund Inc.,Finance,Investment Managers
AE,Adams Resources & Energy Inc. Common Stock,Energy,Oilfield Services/Equipment
AEAE,AltEnergy Acquisition Corp. Class A Common Stock,Industrials,Consumer Electronics/Appliances
AEAEU,AltEnergy Acquisition Corp. Unit,Industrials,Consumer Electronics/Appliances
AEAEW,AltEnergy Acquisition Corp. Warrant,Industrials,Consumer Electronics/Appliances
AEE,Ameren Corporation Common Stock,Utilities,Power Generation
AEF,abrdn Emerging Markets Equity Income Fund Inc. Common Stock,Finance,Finance/Investors Services
AEHR,Aehr Test Systems Common Stock,Industrials,Electrical Products
AEI,Alset Inc. Common Stock (TX),Real Estate,Building operators
AEIS,Advanced Energy Industries Inc. Common Stock,Consumer Discretionary,Electrical Products
AEL,American Equity Investment Life Holding Company Common Stock,Finance,Life Insurance
AEMD,Aethlon Medical Inc. Common Stock,Miscellaneous,Diversified Commercial Services
AEO,American Eagle Outfitters Inc. Common Stock,Consumer Discretionary,Clothing/Shoe/Accessory Stores
AEP,American Electric Power Company Inc. Common Stock,Utilities,Electric Utilities: Central
AEPPZ,American Electric Power Company Inc. Corporate Units,Utilities,Electric Utilities: Central
AES,The AES Corporation Common Stock,Utilities,Electric Utilities: Central
AESC,The AES Corporation Corporate Units,Utilities,Electric Utilities: Central
AEY,ADDvantage Technologies Group Inc. Common Stock,Consumer Discretionary,Durable Goods
AEYE,AudioEye Inc. Common Stock,Technology,EDP Services
AEZS,Aeterna Zentaris Inc. Common Stock,Health Care,Pharmaceuticals and Biotechnology
AFB,AllianceBernstein National Municipal Income Fund Inc,Finance,Trusts Except Educational Religious and Charitable
AFBI,Affinity Bancshares Inc. Common Stock (MD),Finance,Major Banks
AFCG,AFC Gamma Inc. Common Stock,Real Estate,Real Estate Investment Trusts
AFG,American Financial Group Inc. Common Stock,Finance,Property-Casualty Insurers
AFGB,American Financial Group Inc. 5.875% Subordinated Debentures due 2059,Finance,Property-Casualty Insurers
AFGC,American Financial Group Inc. 5.125% Subordinated Debentures due 2059,Finance,Real Estate
AFGD,American Financial Group Inc. 5.625% Subordinated Debentures due 2060,Finance,Property-Casualty Insurers
AFGE,American Financial Group Inc. 4.500% Subordinated Debentures due 2060,Finance,Property-Casualty Insurers
AFIB,Acutus Medical Inc. Common Stock,Health Care,Biotechnology: Electromedical & Electrotherapeutic Apparatus
AFL,AFLAC Incorporated Common Stock,Finance,Accident &Health Insurance
AFRM,Affirm Holdings Inc. Class A Common Stock,Technology,EDP Services
AFYA,Afya Limited Class A Common Shares,Real Estate,Other Consumer Services
AGAE,Allied Gaming & Entertainment Inc. Common Stock,Telecommunications,Cable & Other Pay Television Services
AGCO,AGCO Corporation Common Stock,Industrials,Industrial Machinery/Components
AGD,abrdn Global Dynamic Dividend Fund Common Shares of Beneficial Interest,Finance,Trusts Except Educational Religious and Charitable
AGEN,Agenus Inc. Common Stock,Health Care,Biotechnology: Biological Products (No Diagnostic Substances)
AGFY,Agrify Corporation Common Stock,Consumer Discretionary,Military/Government/Technical
AGGR,Agile Growth Corp. Class A Ordinary Share,Finance,Blank Checks
AGGRW,Agile Growth Corp. Warrant.,Finance,Blank Checks
AGIL,AgileThought Inc. Class A Common Stock,Technology,EDP Services
AGIO,Agios Pharmaceuticals Inc. Common Stock,Health Care,Biotechnology: Pharmaceutical Preparations
AGLE,Aeglea BioTherapeutics Inc. Common Stock,Health Care,Biotechnology: Pharmaceutical Preparations
AGM,Federal Agricultural Mortgage Corporation Common Stock,Finance,Finance Companies
AGNC,AGNC Investment Corp. Common Stock,Real Estate,Real Estate Investment Trusts
AGNCL,AGNC Investment Corp. Depositary Shares Each Representing a 1/1000th Interest in a Share of 7.75% Series G Fixed-Rate Reset Cumulative Redeemable Preferred Stock,Real Estate,Real Estate Investment Trusts
AGNCM,AGNC Investment Corp. Depositary Shares rep 6.875% Series D Fixed-to-Floating Cumulative Redeemable Preferred Stock,Real Estate,Real Estate Investment Trusts
AGNCN,AGNC Investment Corp. Depositary Shares Each Representing a 1/1000th Interest in a Share of 7.00% Series C Fixed-To-Floating Rate Cumulative Redeemable Preferred Stock,Real Estate,Real Estate Investment Trusts
AGNCO,AGNC Investment Corp. Depositary Shares each representing a 1/1000th interest in a share of 6.50% Series E Fixed-to-Floating Cumulative Redeemable Preferred Stock,Real Estate,Real Estate Investment Trusts
AGNCP,AGNC Investment Corp. Depositary Shares Each Representing a 1/1000th Interest in a Share of 6.125% Series F Fixed-to-Floating Rate Cumulative Redeemable Preferred Stock,Real Estate,Real Estate Investment Trusts
AGR,Avangrid Inc. Common Stock,Utilities,Electric Utilities: Central
AGRX,Agile Therapeutics Inc. Common Stock,Health Care,Biotechnology: Pharmaceutical Preparations
AGS,PlayAGS Inc. Common Stock,Consumer Discretionary,Recreational Games/Products/Toys
AGX,Argan Inc. Common Stock,Industrials,Oilfield Services/Equipment
AGYS,Agilysys Inc. Common Stock (DE),Technology,Computer Software: Prepackaged Software
AHCO,AdaptHealth Corp. Common Stock,Health Care,Biotechnology: Electromedical & Electrotherapeutic Apparatus
AHH,Armada Hoffler Properties Inc. Common Stock,Real Estate,Real Estate Investment Trusts
AHT,Ashford Hospitality Trust Inc Common Stock,Real Estate,Real Estate Investment Trusts
AIB,AIB Acquisition Corporation Class A Ordinary Shares,Finance,Blank Checks
AIBBR,AIB Acquisition Corporation Right,Finance,Blank Checks
AIC,Arlington Asset Investment Corp 6.750% Notes due 2025,Real Estate,Real Estate Investment Trusts
AIG,American International Group Inc. New Common Stock,Finance,Life Insurance
AIM,AIM ImmunoTech Inc. Common Stock,Health Care,Biotechnology: Biological Products (No Diagnostic Substances)
AIMAU,Aimfinity Investment Corp. I Unit,Finance,Blank Checks
AIMAW,Aimfinity Investment Corp. I Warrant,Finance,Blank Checks
AIMBU,Aimfinity Investment Corp. I Subunit,Finance,Blank Checks
AIMC,Altra Industrial Motion Corp. Common Stock,Industrials,Industrial Machinery/Components
AIMD,Ainos Inc. Common Stock,Health Care,Biotechnology: Pharmaceutical Preparations
AIMDW,Ainos Inc. Warrants,Health Care,Biotechnology: Pharmaceutical Preparations
AIN,Albany International Corporation Common Stock,Consumer Discretionary,Textiles
AINC,Ashford Inc. (Holding Company) Common Stock,Finance,Investment Managers
AIP,Arteris Inc. Common Stock,Technology,Semiconductors
AIR,AAR Corp. Common Stock,Industrials,Aerospace
AIRG,Airgain Inc. Common Stock,Technology,Radio And Television Broadcasting And Communications Equipment
AIRI,Air Industries Group Common Stock,Industrials,Military/Government/Technical
AIRS,AirSculpt Technologies Inc. Common Stock,Health Care,Hospital/Nursing Management
AIRT,Air T Inc. Common Stock,Consumer Discretionary,Air Freight/Delivery Services
AIRTP,Air T Inc. Air T Funding Alpha Income Trust Preferred Securities,Consumer Discretionary,Air Freight/Delivery Services
AIT,Applied Industrial Technologies Inc. Common Stock,Industrials,Industrial Machinery/Components
AIV,Apartment Investment and Management Company Common Stock,Real Estate,Real Estate Investment Trusts
AIZ,Assurant Inc. Common Stock,Finance,Specialty Insurers
AIZN,Assurant Inc. 5.25% Subordinated Notes due 2061,Finance,Accident &Health Insurance
AJG,Arthur J. Gallagher & Co. Common Stock,Finance,Specialty Insurers
AJRD,Aerojet Rocketdyne Holdings Inc. Common Stock,Industrials,Military/Government/Technical
AJX,Great Ajax Corp. Common Stock,Real Estate,Real Estate Investment Trusts
AJXA,Great Ajax Corp. 7.25% Convertible Senior Notes due 2024,Real Estate,Real Estate Investment Trusts
AKAM,Akamai Technologies Inc. Common Stock,Consumer Discretionary,Business Services
AKBA,Akebia Therapeutics Inc. Common Stock,Health Care,Biotechnology: Pharmaceutical Preparations
AKLI,Akili Inc. Common Stock,Technology,Computer Software: Prepackaged Software
AKR,Acadia Realty Trust Common Stock,Real Estate,Real Estate Investment Trusts
AKRO,Akero Therapeutics Inc. Common Stock,Health Care,Biotechnology: Pharmaceutical Preparations
AKTS,Akoustis Technologies Inc. Common Stock,Utilities,Telecommunications Equipment
AKU,Akumin Inc. Common Stock (DE),Health Care,Medical Specialities
AKYA,Akoya BioSciences Inc. Common Stock,Industrials,Medical Specialities
AL,Air Lease Corporation Class A Common Stock,Consumer Discretionary,Diversified Commercial Services
ALB,Albemarle Corporation Common Stock,Industrials,Industrial Specialties
ALBT,Avalon GloboCare Corp. Common Stock,Real Estate,Building operators
ALDX,Aldeyra Therapeutics Inc. Common Stock,Health Care,Biotechnology: Pharmaceutical Preparations
ALE,Allete Inc.,Utilities,Power Generation
ALEC,Alector Inc. Common Stock,Health Care,Biotechnology: Pharmaceutical Preparations
ALEX,Alexander & Baldwin Inc. Common Stock REIT Holding Company,Real Estate,Real Estate Investment Trusts
ALG,Alamo Group Inc. Common Stock,Industrials,Industrial Machinery/Components
ALGM,Allegro MicroSystems Inc. Common Stock,Technology,Semiconductors
ALGN,Align Technology Inc. Common Stock,Health Care,Industrial Specialties
ALGS,Aligos Therapeutics Inc. Common Stock,Health Care,Biotechnology: Pharmaceutical Preparations
ALGT,Allegiant Travel Company Common Stock,Consumer Discretionary,Air Freight/Delivery Services
ALHC,Alignment Healthcare Inc. Common Stock,Health Care,Medical Specialities
ALIM,Alimera Sciences Inc. Common Stock,Health Care,Biotechnology: Pharmaceutical Preparations
ALK,Alaska Air Group Inc. Common Stock,Consumer Discretionary,Air Freight/Delivery Services
ALKT,Alkami Technology Inc. Common Stock,Technology,EDP Services
ALL,Allstate Corporation (The) Common Stock,Finance,Property-Casualty Insurers
ALLE,Allegion plc Ordinary Shares,Consumer Discretionary,Diversified Commercial Services
ALLK,Allakos Inc. Common Stock,Health Care,Biotechnology: Pharmaceutical Preparations
ALLO,Allogene Therapeutics Inc. Common Stock,Health Care,Biotechnology: Biological Products (No Diagnostic Substances)
ALLR,Allarity Therapeutics Inc. Common Stock,Health Care,Biotechnology: Pharmaceutical Preparations
ALLY,Ally Financial Inc. Common Stock,Finance,Diversified Financial Services
ALNY,Alnylam Pharmaceuticals Inc. Common Stock,Health Care,Biotechnology: Pharmaceutical Preparations
ALOR,ALSP Orchid Acquisition Corporation I Class A Ordinary Share,Finance,Blank Checks
ALOT,AstroNova Inc. Common Stock,Technology,Computer peripheral equipment
ALPA,Alpha Healthcare Acquisition Corp. III Class A Common Stock,Industrials,Consumer Electronics/Appliances
ALPAU,Alpha Healthcare Acquisition Corp. III Units,Industrials,Consumer Electronics/Appliances
ALPAW,Alpha Healthcare Acquisition Corp. III Warrant,Industrials,Consumer Electronics/Appliances
ALPN,Alpine Immune Sciences Inc. Common Stock,Health Care,Biotechnology: Pharmaceutical Preparations
ALPP,Alpine 4 Holdings Inc. Class A Common Stock,Industrials,Consumer Electronics/Appliances
ALR,AlerisLife Inc. Common Stock,Health Care,Hospital/Nursing Management
ALRM,Alarm.com Holdings Inc. Common Stock,Technology,Computer Software: Prepackaged Software
ALRN,Aileron Therapeutics Inc. Common Stock,Health Care,Biotechnology: Pharmaceutical Preparations
ALRS,Alerus Financial Corporation Common Stock,Finance,Commercial Banks
ALSA,Alpha Star Acquisition Corporation Ordinary Shares,Finance,Blank Checks
ALSAR,Alpha Star Acquisition Corporation Rights,Finance,Blank Checks
ALSAW,Alpha Star Acquisition Corporation Warrants,Finance,Blank Checks
ALSN,Allison Transmission Holdings Inc. Common Stock,Consumer Discretionary,Auto Parts:O.E.M.
ALT,Altimmune Inc. Common Stock,Health Care,Biotechnology: Pharmaceutical Preparations
ALTI,Alvarium Tiedemann Holdings Inc. Class A Common Stock,Finance,Investment Managers
ALTIW,Alvarium Tiedemann Holdings Inc. Warrant,Finance,Investment Managers
ALTO,Alto Ingredients Inc. Common Stock,Industrials,Industrial Specialties
ALTR,Altair Engineering Inc. Class A Common Stock,Technology,Computer Software: Prepackaged Software
ALTU,Altitude Acquisition Corp. Class A Common Stock,Industrials,Consumer Electronics/Appliances
ALTUW,Altitude Acquisition Corp. Warrant,Industrials,Consumer Electronics/Appliances
ALVR,AlloVir Inc. Common Stock,Health Care,Biotechnology: Pharmaceutical Preparations
ALX,Alexander's Inc. Common Stock,Real Estate,Real Estate Investment Trusts
ALXO,ALX Oncology Holdings Inc. Common Stock,Health Care,Biotechnology: Pharmaceutical Preparations
ALZN,Alzamend Neuro Inc. Common Stock,Health Care, Medicinal Chemicals and Botanical Products 
AM,Antero Midstream Corporation Common Stock,Utilities,Natural Gas Distribution
AMAL,Amalgamated Financial Corp. Common Stock (DE),Finance,Commercial Banks
AMAT,Applied Materials Inc. Common Stock,Technology,Semiconductors
AMBA,Ambarella Inc. Ordinary Shares,Technology,Semiconductors
AMBC,Ambac Financial Group Inc. Common Stock,Finance,Property-Casualty Insurers
AMCX,AMC Networks Inc. Class A Common Stock,Consumer Discretionary,Movies/Entertainment
AMD,Advanced Micro Devices Inc. Common Stock,Technology,Semiconductors
AME,AMETEK Inc.,Consumer Discretionary,Metal Fabrications
AMED,Amedisys Inc Common Stock,Health Care,Medical/Nursing Services
AMEH,Apollo Medical Holdings Inc. Common Stock,Health Care,Managed Health Care
AMG,Affiliated Managers Group Inc. Common Stock,Finance,Investment Managers
AMGN,Amgen Inc. Common Stock,Health Care,Biotechnology: Pharmaceutical Preparations
AMK,AssetMark Financial Holdings Inc. Common Stock,Finance,Finance/Investors Services
AMKR,Amkor Technology Inc. Common Stock,Technology,Semiconductors
AMLI,American Lithium Corp. Common Stock,Industrials,Industrial Machinery/Components
AMLX,Amylyx Pharmaceuticals Inc. Common Stock,Health Care,Biotechnology: Pharmaceutical Preparations
AMN,AMN Healthcare Services Inc AMN Healthcare Services Inc,Health Care,Assisted Living Services
AMNB,American National Bankshares Inc. Common Stock,Finance,Major Banks
AMOT,Allied Motion Technologies Inc.,Industrials,Electrical Products
AMOV,America Movil S.A.B. de C.V. Class A American Depositary Shares,Telecommunications,Telecommunications Equipment
AMP,Ameriprise Financial Inc. Common Stock,Finance,Investment Managers
AMPE,Ampio Pharmaceuticals Inc.,Health Care,Biotechnology: Pharmaceutical Preparations
AMPG,Amplitech Group Inc. Common Stock,Technology,Industrial Machinery/Components
AMPGW,Amplitech Group Inc. Warrants,Technology,Industrial Machinery/Components
AMPH,Amphastar Pharmaceuticals Inc. Common Stock,Health Care,Biotechnology: Pharmaceutical Preparations
AMPL,Amplitude Inc. Class A Common Stock,Technology,EDP Services
AMPY,Amplify Energy Corp. Common Stock,Energy,Oil & Gas Production
AMR,Alpha Metallurgical Resources Inc. Common Stock,Energy,Coal Mining
AMRC,Ameresco Inc. Class A Common Stock,Industrials,Water Sewer Pipeline Comm & Power Line Construction
AMRK,A-Mark Precious Metals Inc. Common Stock,Finance,Investment Bankers/Brokers/Service
AMRS,Amyris Inc. Common Stock,Industrials,Industrial Specialties
AMS,American Shared Hospital Services Common Stock,Health Care,Medical Specialities
AMSC,American Superconductor Corporation Common Stock,Industrials,Office Equipment/Supplies/Services
AMSF,AMERISAFE Inc. Common Stock,Finance,Accident &Health Insurance
AMST,Amesite Inc. Common Stock,Technology,Computer Software: Prepackaged Software
AMSWA,American Software Inc. Class A Common Stock,Technology,Computer Software: Prepackaged Software
